CIN,COMPANY_NAME,COMPANY_STATUS,COMPANY_CLASS,COMPANY_CATEGORY,AUTHORIZED_CAPITAL,PAIDUP_CAPITAL,DATE_OF_REGISTRATION,REGISTERED_STATE,ROC,DESCRIPTION,REGISTERED_OFFICE_ADDRESS,SUB_CATEGORY
U65900PY1993PLC000890,KARAN INDUSTRIAL INVESTMENTS LIMITED,STRIKE OFF,PUBC,CLSH,200000,7000,14-06-93,Pondicherry,RoC-Pondicherry,Finance,"36, Villianur PONDICHERRY Pondicherry Pondicherry INDIA 605007",Indian Non-Government Company
U99999PY1993PTC000891,OLEFIN DERIVATIVES SPECIALITY CHEMICALS PVT LTD,STRIKE OFF,PRIV,CLSH,300000,0,17-06-93,Pondicherry,RoC-Pondicherry,NA,"PLOT NO B-16 PIPDIC INDUSTRIALESTATE,SEDARAPET PONDICHERRY Pondicherry INDIA",Indian Non-Government Company
U74900PY1993PTC000892,EFEX PROJECT ENGINEERS PVT LTD,STRIKE OFF,PRIV,CLSH,200000,40000,21-06-93,Pondicherry,RoC-Pondicherry,Business Services,"90, Laporte st., PONDICHERRY Pondicherry INDIA 605001",Indian Non-Government Company
U65900PY1993PLC000893,V.K.N FINANCE AND INVESTMENTS LTD,STRIKE OFF,PUBC,CLSH,50000,700,21-06-93,Pondicherry,RoC-Pondicherry,Finance,P/9 KAMARAJ GOVT SCHOOL STMUTHIALPET PONDICHERRY 3 Pondicherry INDIA,Indian Non-Government Company
U65900PY1993PLC000894,KALPATHARU GENERAL FINANCE AND INVESTMENTS (INDIA) LTD,STRIKE OFF,PUBC,CLSH,500000,700,24-06-93,Pondicherry,RoC-Pondicherry,Finance,"4, Raja Nagar, PONDICHERRY Pondicherry INDIA 605013",Indian Non-Government Company
U14102PY1993PTC000895,AMBUJA GRANITES PVT LTD,DORMANT,PRIV,CLSH,1000000,1000000,25-06-93,Pondicherry,RoC-Pondicherry,Mining & Quarrying,126 Muthumariamman Koil Street Pondicherry Pondicherry INDIA 605001,Indian Non-Government Company
U19121PY1993PTC000896,K.THANGAVEL CHETTIAR SONS PULSES PVT LTD,STRIKE OFF,PRIV,CLSH,500000,50000,30-06-93,Pondicherry,RoC-Pondicherry,Manufacturing (Leather & products thereof),"RS 147/2, MAIN ROAD,KANIVADIKUPPAM, PONDICHERRY - 605 008 PONDICHERRY - 605 008 Pondicherry INDIA 605008",Indian Non-Government Company
U29219PY1993PTC000897,AVATAR ENGINES PRIVATE LIMITED,STRIKE OFF,PRIV,CLSH,500000,100000,07-02-93,Pondicherry,RoC-Pondicherry,Manufacturing (Machinery & Equipments),C.16 CHANAKYA APARTMENTSPONDICHERRY-605013. PONDICHERRY-605013. Pondicherry INDIA 605013,Indian Non-Government Company
U71110PY1993PTC000898,HIND TRACTORS PVT. LTD.,DORMANT,PRIV,CLSH,500000,215000,07-05-93,Pondicherry,RoC-Pondicherry,Real Estate and Renting,"12, AYYANAR KOIL ST.,PONDICHERRY-605013. PONDICHERRY-605013. Pondicherry INDIA 605013",Indian Non-Government Company
U99999PY1993PTC000899,INDO DOHA POLYMERS PVT. LTD.,STRIKE OFF,PRIV,CLSH,2800000,NA,07-08-93,Pondicherry,RoC-Pondicherry,NA,"107, VELLA ST.,PONDICHERRY-605001. Pondicherry INDIA",Indian Non-Government Company
U99999PY1993PTC000900,ENN ENN PULVERSIERS PVT. LTD.,STRIKE OFF,PRIV,CLSH,1400000,NA,07-08-93,Pondicherry,RoC-Pondicherry,NA,"107 VELLALA ST.,PONDICHERRY-605001. Pondicherry INDIA",Indian Non-Government Company
U17121PY1993PLC000901,STANDARD COTTON MILLS LTD.,STRIKE OFF,PUBC,CLSH,1000000,10000,13-07-93,Pondicherry,RoC-Pondicherry,Manufacturing (Textiles),V.M. COMPLEX1/23 KAMARAJ SALAI PILLAI THOTTAM PONDICHERRY. Pondicherry INDIA,Indian Non-Government Company
U29249PY1993PTC000902,PONDY PROCESS CONTROL VALVES PRIVATE LIMITED,DISSOLVED,PRIV,CLSH,500000,147000,13-07-93,Pondicherry,RoC-Pondicherry,Manufacturing (Machinery & Equipments),"C,15 INDUSTRIAL ESTATETHATTANCHAVADY PONDICHERRY-605009 PONDICHERRY-605009 Pondicherry INDIA 605009",Indian Non-Government Company
U05004PY1993PTC000903,"PETROS AQUA PVT. LTD.,",STRIKE OFF,PRIV,CLSH,5000000,2000000,15-07-93,Pondicherry,RoC-Pondicherry,Agriculture and Allied Activities,"12, PILLAYAR KOIL ST.,KOSAPALAYAM PONDICHERRY-605013. PONDICHERRY-605013. Pondicherry INDIA 605013",Indian Non-Government Company
U21023PY1993PTC000904,JAISHREE CORRO CONTAINERS PVT. LTD.,ACTIVE,PRIV,CLSH,1000000,1000000,21-07-93,Pondicherry,RoC-Pondicherry,"Manufacturing (Paper & Paper products, Publishing, printing and reproduction of recorded media)",#23/10 THUTHIPET VILLAGREPONDICHERRY. PONDICHERRY. Pondicherry INDIA 605502,Indian Non-Government Company
U99999PY1993PTC000905,SHERIFF FARMS AND INVESTMENTS PVT. LTD.,STRIKE OFF,PRIV,CLSH,300000,NA,30-07-93,Pondicherry,RoC-Pondicherry,NA,102 ANGALAMMAN KOIL STREETMUTHIALPET PONDICHERRY PONDICHERY-605010. Pondicherry INDIA,Indian Non-Government Company
U65900PY1993PLC000906,APOLLO INDUSTRIAL INVESTMENTS LTD,STRIKE OFF,PUBC,CLSH,1000000,7000,08-04-93,Pondicherry,RoC-Pondicherry,Finance,44 SELLAPERUMAL STREETKUYAVARPALAYAM PONDICHERRY 605 013 Pondicherry INDIA,Indian Non-Government Company
U74900PY1993PTC000907,SRIVARI SERVICES PRIVATE LIMITED,DORMANT,PRIV,CLSH,10000,6000,16-08-93,Pondicherry,RoC-Pondicherry,Business Services,"AMUTHA ILLAM,12,II CROSS,RAJIV GANDHI NAGAR(BRINDAVANAM 9 CROSS WESTERN .EXTN.) PONDICHERRY-605013 Pondicherry INDIA 605013",Indian Non-Government Company
U99999PY1993PTC000908,SHREYAS TRANSDUCERS PVT LTD,STRIKE OFF,PRIV,CLSH,500000,NA,17-08-93,Pondicherry,RoC-Pondicherry,NA,"A 87, INDUSTRIAL ESTATE,METTUPALAYAM PONDICHERRY - 605 009 Pondicherry INDIA",Indian Non-Government Company
U25199PY1993PTC000909,MICRO STRETCH ELASTOMERSPVT LTD,DORMANT,PRIV,CLSH,500000,490000,19-08-93,Pondicherry,RoC-Pondicherry,"Manufacturing (Metals & Chemicals, and products thereof)","R.S.NO.42/1&3,BUILDING NO.9/B,MAIN ROAD, SEDARAPET PONDICHERRY-605 101. PONDICHERRY-605 101. Pondicherry INDIA 605101",Indian Non-Government Company
U25199PY1993PLC000910,JABEZ (INDIA) LIMITED,ACTIVE,PUBC,CLSH,10000000,7504000,19-08-93,Pondicherry,RoC-Pondicherry,"Manufacturing (Metals & Chemicals, and products thereof)","Flat No - 57, Rose Apartments Venkata Nagar Pondicherry Pondicherry INDIA 605011",Indian Non-Government Company
L15142PY1993PLC000911,J.R.FOODS LIMITED,ACTIVE,PUBC,CLSH,100000000,95000000,20-08-93,Pondicherry,RoC-Pondicherry,Manufacturing (Food stuffs),J K TOWERS100 FEET ROAD PONDICHERRY-605013 PONDICHERRY 605 013. Pondicherry INDIA 605013,Indian Non-Government Company
U65921PY1993PTC000912,SRIVARI INVESTMENTS PVT LTD,DORMANT,PRIV,CLSH,500000,374000,23-08-93,Pondicherry,RoC-Pondicherry,Finance,"NO.III FIRST STREETPON NAGAR REDDIARPALAYAM, PONDICHERRY 605 010. Pondicherry INDIA 605010",Indian Non-Government Company
U99999PY1993PTC000913,VISIONS MARKETING PVT LTD,STRIKE OFF,PRIV,CLSH,450000,NA,25-08-93,Pondicherry,RoC-Pondicherry,NA,"14 UPSTAIRS, GOVINDAN STREETANANDHA NAGAR PONDICHERRY 9 Pondicherry INDIA",Indian Non-Government Company
U99999PY1993PTC000914,STANDARD POWER DISTRIBUTORS PVT.LTD.,STRIKE OFF,PRIV,CLSH,200000,NA,15-09-93,Pondicherry,RoC-Pondicherry,NA,"PLOTNO.A.27,28 &41 PIPDIC INDUSTRIAL ESTATE SEDARAPET, PONDICHERRY Pondicherry INDIA",Indian Non-Government Company
U99999PY1993PTC000915,DOLPHIN RESORTS PVT. LTD.,STRIKE OFF,PRIV,CLSH,300000,NA,15-09-93,Pondicherry,RoC-Pondicherry,NA,"48, FIRST CROSS,THIRUMUDI NAGAR PONDICHERRY Pondicherry INDIA",Indian Non-Government Company
U99999PY1993PTC000916,SIMHA ORGANICS PVT. LTD.,STRIKE OFF,PRIV,CLSH,200000,NA,15-09-93,Pondicherry,RoC-Pondicherry,NA,NO.189 9TH CROSSKURUNJI NAGAR PONDICHERRY-605 008. Pondicherry INDIA,Indian Non-Government Company
U10201PY1993PTC000918,SPECTRUM GRANITES PVT. LTD.,DORMANT,PRIV,CLSH,450000,450000,27-09-93,Pondicherry,RoC-Pondicherry,Mining & Quarrying,"12, PILLIAR KOIL ST.,KOSAPALAYAM, PONDICHERRY Pondicherry INDIA",Indian Non-Government Company
U99999PY1993PTC000919,SREENIVAS SEAFOODS PVT. LTD.,STRIKE OFF,PRIV,CLSH,500000,NA,30-09-93,Pondicherry,RoC-Pondicherry,NA,"107, VELLA ST,PONDICHERRY 605 001. Pondicherry INDIA",Indian Non-Government Company
U65900PY1993PLC000920,LAKSHMI INDUSTRIAL INVESTMENT LTD.,STRIKE OFF,PUBC,CLSH,300000,9000,10-05-93,Pondicherry,RoC-Pondicherry,Finance,"NO.24 VILIYANUR MAIN ROAD,ARUNPATHAPURAM, PONDICHERRY 605 010. Pondicherry INDIA",Indian Non-Government Company
U19201PY1993PLC000922,INDOKOREA EXPORT LTD.,ACTIVE,PUBC,CLSH,120000000,106041000,21-10-93,Pondicherry,RoC-Pondicherry,Manufacturing (Leather & products thereof),C/O RAM LEATHER EXPORT LTDVADAMANGALAM KANDAMANGALAM PONDIHCHERRY - 605 102. PONDIHCHERRY Pondicherry INDIA 605102,Indian Non-Government Company
U17126PY1993PTC000923,BHARANI TEXTILES PVT LTD,STRIKE OFF,PRIV,CLSH,2000000,0,11-03-93,Pondicherry,RoC-Pondicherry,Manufacturing (Textiles),"1,7TH CROSSILANGONAGAR PONDICHERRY Pondicherry INDIA",Indian Non-Government Company
U51511PY1993PTC000924,BALAJI DISPLAY DEVICES PRIVATE LIMITED,AMALGAMATED,PRIV,CLSH,20000000,0,11-10-93,Pondicherry,RoC-Pondicherry,Trading,"24TH CROSS,6TH MAIN ROAD,MSI AREA PIPDIC INDUSTRIAL EAS TE METTUPALAYAM,PONDY-9. PONDICHERRY-605009 Pondicherry INDIA",Indian Non-Government Company
U99999PY1993PTC000925,TRISULAM COMMERCIAL SERVICES PVT LTD,STRIKE OFF,PRIV,CLSH,100000,NA,26-11-93,Pondicherry,RoC-Pondicherry,NA,"C/O SAIRAM CHEMICALS,64, VALUDAVUR ROAD MUTHIRAPALAYAM PONDICHERRY-605009 Pondicherry INDIA",Indian Non-Government Company
U99999PY1993PTC000926,SOUTHERN INDUSTRIAL FINANCIERS AND INVESTMENTS PVT LTD,STRIKE OFF,PRIV,CLSH,200000,NA,26-11-93,Pondicherry,RoC-Pondicherry,NA,16-A IIICROSS STILANGONAGAR PONDICHERRY-605011 Pondicherry INDIA,Indian Non-Government Company
U30009PY1993PTC000927,MICROWORLD SYTEMS PVT. LTD,STRIKE OFF,PRIV,CLSH,500000,151000,12-03-93,Pondicherry,RoC-Pondicherry,Manufacturing (Machinery & Equipments),"NO100 ANNASALAI, PONDICHERRY NO100 ANNASALAI, PONDICHERRY Pondicherry INDIA",Indian Non-Government Company
U99999PY1993PTC000928,BHARAT AGRO FARMS AND PLANTATIONS PVT LTD,STRIKE OFF,PRIV,CLSH,5000000,0,13-12-93,Pondicherry,RoC-Pondicherry,NA,"C/O YESHEBA AGENCIESNO.231, J.N.STREET, PONDICHERRY Pondicherry INDIA",Indian Non-Government Company
U65992PY1993PTC000929,SREE SAPTHAGIRI CHITS PVT LTD,DORMANT,PRIV,CLSH,300000,183000,13-12-93,Pondicherry,RoC-Pondicherry,Finance,"127,CALVE SUBBRAYA CHETTYSTREET PONDICHERRY PONDICHERRY Pondicherry INDIA 605001",Indian Non-Government Company
U24249PY1993PTC000930,BALA NATURAL AND HEALTH FARMS PVT. LTD,STRIKE OFF,PRIV,CLSH,1000000,13000,15-12-93,Pondicherry,RoC-Pondicherry,"Manufacturing (Metals & Chemicals, and products thereof)","52, Bharathy Nagar PONDICHERRY 605 008 Pondicherry INDIA 605008",Indian Non-Government Company
U15493PY1993PTC000931,A.M.AGRO FOODS PRIVATE LIMITED,ACTIVE,PRIV,CLSH,7000000,7000000,23-12-93,Pondicherry,RoC-Pondicherry,Manufacturing (Food stuffs),"DOOR NO 1, ABIRAMI AMMAN WEST STREET T.R.PATTINAM KARAIKKAL Pondicherry INDIA 609606",Indian Non-Government Company
U74950PY1994PTC000932,PONDY JASMIN PACKAGING PVT LTD,UNDER LIQUIDATION,PRIV,CLSH,4200000,2000000,01-07-94,Pondicherry,RoC-Pondicherry,Business Services,"NO.19 CHERAN STREET,IST FLOOR, MULLAINAGAR, OPP. NEW BUS STAND, PONDICHERRY Pondicherry INDIA",Indian Non-Government Company
U99999PY1994PTC000933,KARAIKAL COMMERCIAL CHITS PVT LTD,STRIKE OFF,PRIV,CLSH,100000,NA,01-11-94,Pondicherry,RoC-Pondicherry,NA,30/E FIRST FLOOR CHURCH STREETKARAIKAL U.T.PONDICHERRY Pondicherry INDIA,Indian Non-Government Company
U65923PY1994PTC000934,ANNAIAMAR FINANCE PRIVATE LIMITED,ACTIVE,PRIV,CLSH,5000000,3357073,01-11-94,Pondicherry,RoC-Pondicherry,Finance,"NO. 8, 1ST FLOOR, THIRUVALLUVAR STREET KAMARAJ NAGAR PONDICHERRY Pondicherry INDIA 605013",Indian Non-Government Company
U99999PY1994PTC000935,SANKAR GASKETS PVT LTD,STRIKE OFF,PRIV,CLSH,400000,NA,01-12-94,Pondicherry,RoC-Pondicherry,NA,NO.80 SHRUTHI IVTH CROSS ROADNATESAN NAGAR PONDICHERRY Pondicherry INDIA,Indian Non-Government Company
U99999PY1994PTC000936,SREENIVASA CHEMICALS AND ALLOYS PVT LTD,STRIKE OFF,PRIV,CLSH,200000,0,18-01-94,Pondicherry,RoC-Pondicherry,NA,A 122 PIPDIC ESTATEMETTUPALAYAM PONDICHERRY 605 009 Pondicherry INDIA,Indian Non-Government Company
U99999PY1994PTC000937,STERLING FOUNDATIONS PVT LTD,STRIKE OFF,PRIV,CLSH,500000,NA,27-01-94,Pondicherry,RoC-Pondicherry,NA,STERLING PLAZA 74 CANTEENSTREET FIRST FLOOR PONDICHERRY 605 001 Pondicherry INDIA,Indian Non-Government Company
U31900PY1994PTC000938,ATHIAPPA ELECTRICAL AND ELECTRONICS P. LTD,ACTIVE,PRIV,CLSH,500000,500000,27-01-94,Pondicherry,RoC-Pondicherry,Manufacturing (Machinery & Equipments),A-52 INDUSTRIAL ESTATEMETTUPALAYAM PONDICHERRY 605 009 PONDICHERRY 605 009 Pondicherry INDIA 605009,Indian Non-Government Company
U33121PY1994PTC000939,MANATEC AUTOMATIONS PRIVATE LIMITED,ACTIVE,PRIV,CLSH,2500000,2250000,31-01-94,Pondicherry,RoC-Pondicherry,Manufacturing (Machinery & Equipments),"NO.6 KUMARAN STREET, KAMARAJ NAGAR PONDICHERRY Pondicherry INDIA 605011",Indian Non-Government Company
U99999PY1994PTC000940,SIVA INVESTMENT AND FINANCE COMPANY PVTLTD,STRIKE OFF,PRIV,CLSH,1000000,NA,02-07-94,Pondicherry,RoC-Pondicherry,NA,"C/O PONDICHERRY NIDHI LTD189A, MISION ST, PONDICHERRY 605 001 Pondicherry INDIA",Indian Non-Government Company
U51396PY1994PTC000942,BASEN BAGS PONDICHERRY PRIVATE LIMITED,STRIKE OFF,PRIV,CLSH,2500000,250000,02-10-94,Pondicherry,RoC-Pondicherry,Trading,32/F CAUVERY NAGARREDDIARPALAYAM PONDICHERRY 10 PONDICHERRY 10 Pondicherry INDIA 605010,Indian Non-Government Company
U99999PY1994PTC000943,THE PONDICHERRY MOTOR FINANCEE PVT. LTD,STRIKE OFF,PRIV,CLSH,1000000,NA,23-02-94,Pondicherry,RoC-Pondicherry,NA,"NO.455, FIRST FLOOR, MOTORSIERST. PONDICHERRY 605 001 Pondicherry INDIA",Indian Non-Government Company
U99999PY1994PTC000944,VIVI EXPORTS PRIVATE LTD,STRIKE OFF,PRIV,CLSH,1000000,NA,23-02-94,Pondicherry,RoC-Pondicherry,NA,"5, FIRST CROSS, VIVIKANANDA NAGARPONDICHERRY Pondicherry INDIA",Indian Non-Government Company
U15400PY1994PLC000945,KAMALA BIO-AQUA FEEDS AND FARMS LIMITED,STRIKE OFF,PUBC,CLSH,2500000,350,03-02-94,Pondicherry,RoC-Pondicherry,Manufacturing (Food stuffs),"61-A, 16TH CROSS, RAJAJINAGAR,LAWSPET PONDICHERRY 605 008 Pondicherry INDIA",Indian Non-Government Company
U74900PY1994PTC000946,RAMRAJ TRADING COMPANY PRIVATE LIMITED,ACTIVE,PRIV,CLSH,7500000,100000,03-04-94,Pondicherry,RoC-Pondicherry,Business Services,"DOOR NO 1, ABIRAMI AMMAN WEST STREET T.R.PATTINAM KARAIKKAL Pondicherry INDIA 609606",Indian Non-Government Company
U26933PY1994PLC000947,PRIYA CERAMICS LIMITED,DORMANT,PUBC,CLSH,12500000,8050000,03-09-94,Pondicherry,RoC-Pondicherry,"Manufacturing (Metals & Chemicals, and products thereof)","11,ANNA STREETINDIRA NAGAR MUDALIARPET PONDICHERRY Pondicherry INDIA 605004",Indian Non-Government Company
U65991PY1994PLC000948,SHREE ISWARIYA BENEFIT FUND LIMITED,STRIKE OFF,PUBC,CLSH,200000,0,03-09-94,Pondicherry,RoC-Pondicherry,Finance,"NO.8, CUDDALORE PONDY MAIN ROAD, KANNIA KOIL BAHOUR COMMUNE PONDICHERRY PONDICHERRY Pondicherry INDIA",Indian Non-Government Company
U74900PY1994PLC000949,STEEL TILES (INDIA) LIMITED,STRIKE OFF,PUBC,CLSH,500000,0,03-11-94,Pondicherry,RoC-Pondicherry,Business Services,"4-333,ANYAM GARDENS,YANAM 533 464. YANAM 533 464. Pondicherry INDIA",Indian Non-Government Company
U99999PY1994PTC000950,MANTRUST FINANCIAL SERVICEES (MADRAS) PVT. LTD,STRIKE OFF,PRIV,CLSH,500000,0,03-11-94,Pondicherry,RoC-Pondicherry,NA,"NO.45, MARKET ST., THIRUMSLARAYANPATTINSM KSRAIKAL Pondicherry INDIA",Indian Non-Government Company
U99999PY1994PTC000951,BOTTINE INDIA PRIVATE LTD,STRIKE OFF,PRIV,CLSH,600000,NA,16-03-94,Pondicherry,RoC-Pondicherry,NA,"GOPALANKADAI,IYYANKUTTIPALAYAMPONDICHERRY 605 009 Pondicherry INDIA",Indian Non-Government Company
U27201PY1994PTC000952,AURO ENAMELLED WIRES PRIVATE LTD,DORMANT,PRIV,CLSH,2000000,221990,17-03-94,Pondicherry,RoC-Pondicherry,"Manufacturing (Metals & Chemicals, and products thereof)",C 20 PIPDIC INDUSTRIAL ESTATEMETTUPALAYAM PONDICHERRY 605 009 605 009 Pondicherry INDIA 605009,Indian Non-Government Company
U55101PY1994PLC000953,GEMINI HOTELS AND HOLDINGS LIMITED,AMALGAMATED,PUBC,CLSH,250000000,0,30-03-94,Pondicherry,RoC-Pondicherry,Trading,"26, VENKATA NAGAR,1 CROSS STREET, PONDICHERRY-605011. PONDICHERRY-605 011. Pondicherry INDIA",Indian Non-Government Company
U74900PY1994PTC000954,PONDICHERRY INFRASTRUCTURES COMPANY PRIVATE LIMITED,STRIKE OFF,PRIV,CLSH,1000000,0,04-08-94,Pondicherry,RoC-Pondicherry,Business Services,PONDICHERRY 605 011 Pondicherry INDIA,Indian Non-Government Company
U99999PY1994PTC000956,BAGHYASRI EXPORTS PRIVATE LIMITED,STRIKE OFF,PRIV,CLSH,1000000,0,15-04-94,Pondicherry,RoC-Pondicherry,NA,"NO.61 E, UPSTAIRS 8TH CROSS,BRINDAVANAM PONDICHERRY 605 011 Pondicherry INDIA",Indian Non-Government Company
U55101PY1994PTC000957,VAILANKANNI HOTELS P. LTD,ACTIVE,PRIV,CLSH,5000000,220000,15-04-94,Pondicherry,RoC-Pondicherry,Trading,"381 M.G. ROAD,PONDICHERRY 605 001 PONDICHERRY 605 001 Pondicherry INDIA 605001",Indian Non-Government Company
U28910PY1994PTC000958,ESWARI PRESSINGS PRIVATE LTD,STRIKE OFF,PRIV,CLSH,500000,100000,05-02-94,Pondicherry,RoC-Pondicherry,"Manufacturing (Metals & Chemicals, and products thereof)","NO.15, SENTHAMARAI STREET,KATHIRKAMAM, JIPMER, PONDICHERRY - 605 009. PONDICHERRY - 605 009. Pondicherry INDIA 605009",Indian Non-Government Company
U65900PY1994PLC000959,SRI THILLAI NATARAJA BENEFIT FUND LTD,STRIKE OFF,PUBC,CLSH,300000,120407,05-05-94,Pondicherry,RoC-Pondicherry,Finance,"81 BHARATHIDASAN STREET MUTHIALPET,PONDICHERRY 605 003 PONDICHERRY Pondicherry INDIA 605003",Indian Non-Government Company
U65910PY1994PLC000960,HARENE INVESTMENTS AND LEASING INDIA LTD,STRIKE OFF,PUBC,CLSH,500000,0,05-05-94,Pondicherry,RoC-Pondicherry,Finance,NO.9 REGAL BUILDINGOPP.TO NEW BUS STAND PONDICHERRY 13 Pondicherry INDIA,Indian Non-Government Company
U65900PY1994PLC000961,THE NEW INDIA INDUSTRIAL AND SAVINGS COMPANY LTD,DORMANT,PUBC,CLSH,500000,300000,05-06-94,Pondicherry,RoC-Pondicherry,Finance,"NO. 12, POLICE LINE QURS. ST.,VENKATANAGAR PONDICHERRY 11 Pondicherry INDIA",Indian Non-Government Company
U74900PY1994PLC000962,ASIAN DYKE LTD,STRIKE OFF,PUBC,CLSH,10000000,0,05-10-94,Pondicherry,RoC-Pondicherry,Business Services,NO.6 ILANGO NAGARPONDICHERRY Pondicherry INDIA,Indian Non-Government Company
U74900PY1994PTC000963,MIRA LEDERTEC (PONDY) P. LTD,DORMANT,PRIV,CLSH,150000,100000,05-12-94,Pondicherry,RoC-Pondicherry,Business Services,"A-9, INDUSTRIAL ESTATE,THATTANCHAVADY, PONDICHERRY-605009. Pondicherry INDIA",Indian Non-Government Company
U65992PY1994PTC000964,SHREE BHUVANESWARI CHITS (PONDY) P. LTD,ACTIVE,PRIV,CLSH,300000,300000,13-05-94,Pondicherry,RoC-Pondicherry,Finance,91 CHETTY STREET PONDICHERRY 1 PONDICHERRY 1 Pondicherry INDIA 605001,Indian Non-Government Company
U74900PY1994PLC000965,TRINITY MARINE HOLDINGS (INDIA) LTD,STRIKE OFF,PUBC,CLSH,1000000,0,16-05-94,Pondicherry,RoC-Pondicherry,Business Services,PONDICHERRY 605 001 605001 Pondicherry INDIA,Indian Non-Government Company
U25199PY1994PTC000966,RONSON RUBBERS PRIVATE LTD,ACTIVE,PRIV,CLSH,1000000,835100,20-05-94,Pondicherry,RoC-Pondicherry,"Manufacturing (Metals & Chemicals, and products thereof)",NO A-9 INDUSTRIAL ESTATEMETTUPPALAYAM PONDICHERRY PONDICHERRY Pondicherry INDIA,Indian Non-Government Company
U19115PY1994PTC000967,PERFECT LEATHER EXPORTS (I)P. LTD,STRIKE OFF,PRIV,CLSH,1250000,1600,24-05-94,Pondicherry,RoC-Pondicherry,Manufacturing (Leather & products thereof),"91, Rangapillai St, PONDICHERRY 605 001 Pondicherry INDIA 605001",Indian Non-Government Company
U24100PY1994PLC000968,CHEMFAB WELDERS LTD,AMALGAMATED,PUBC,CLSH,3000000000,0,27-05-94,Pondicherry,RoC-Pondicherry,"Manufacturing (Metals & Chemicals, and products thereof)",(TRANSFERRED FROM ROC TAMILNADU) Pondicherry INDIA,Indian Non-Government Company
U99999PY1994PTC000969,IMAYAM SAKTHI TOURS AND TRAVELS PRIVATE LIMITED,STRIKE OFF,PRIV,CLSH,100000,0,06-03-94,Pondicherry,RoC-Pondicherry,NA,"109, ELLAMMAN KOIL STREETPONDICHERRY 605 001 Pondicherry INDIA",Indian Non-Government Company
U99999PY1994PTC000970,INTELLIGENT MACHINES AND ADVANCE SYSTEMS PONDICHERRY PRIVATE LIMITED,STRIKE OFF,PRIV,CLSH,100000,0,06-03-94,Pondicherry,RoC-Pondicherry,NA,"109, ELLAMMAN KOIL STREETPONDICHERRY 605 001 Pondicherry INDIA",Indian Non-Government Company
U99999PY1994PTC000971,IMAYAM SAKTHI ELECTRONICS TRADING PRIVATE LIMITED,STRIKE OFF,PRIV,CLSH,100000,0,06-03-94,Pondicherry,RoC-Pondicherry,NA,"109, ELLAMMAN KOIL STREETPONDICHERRY 605 001 Pondicherry INDIA",Indian Non-Government Company
U99999PY1994PTC000972,SOPRA PULSES EXPORTS PRIVATE LIMITED,STRIKE OFF,PRIV,CLSH,100000,0,06-10-94,Pondicherry,RoC-Pondicherry,NA,"56, AUROBINDO STREET,PONDICHERRY 605 001 Pondicherry INDIA",Indian Non-Government Company
U99999PY1994PTC000973,EVEREST BREEZE PRIVATE LIMITED,STRIKE OFF,PRIV,CLSH,150000,0,15-06-94,Pondicherry,RoC-Pondicherry,NA,"54,GURUNJI STREETBHARATHINAGAR PONDICHERRY 605 009 Pondicherry INDIA",Indian Non-Government Company
U74900PY1994PTC000974,LAKSHMI CALFUSION PRIVATE LIMITED,ACTIVE,PRIV,CLSH,3000000,3000000,16-06-94,Pondicherry,RoC-Pondicherry,Business Services,"118/8,NAGORE MAIN ROAD,KEELAVANJORE-611 002. KARAIKAL Pondicherry INDIA",Indian Non-Government Company
U24100PY1994PLC000975,SOUTH INDIA AGRO CHEMICALS AMD PRODUCTS MARKETING LIMITED,STRIKE OFF,PUBC,CLSH,1000000,0,16-06-94,Pondicherry,RoC-Pondicherry,"Manufacturing (Metals & Chemicals, and products thereof)",44 MISSION STREETPONDICHERRY 1 Pondicherry INDIA,Indian Non-Government Company
U65293PY1994PTC000976,CLARUS COMMERCIAL PRIVATE LIMITED,ACTIVE,PRIV,CLSH,10000000,9318000,23-06-94,Pondicherry,RoC-Pondicherry,NA,"75 COVENT STREET, NELLITHOPOE PUDUCHERRY Pondicherry INDIA 605001",Indian Non-Government Company
U99999PY1994PTC000977,EDIBLE OIL INDIA PRIVATE LIMITED,STRIKE OFF,PRIV,CLSH,500000,0,23-06-94,Pondicherry,RoC-Pondicherry,NA,"1, VILLIANUR MAIN ROADVIVEKANANDA NAGAR PONDICHERRY 605 005 Pondicherry INDIA",Indian Non-Government Company
U74140PY1994PTC000978,PRAMADEKA CONSULTANCY PRIVATE LIMITED,ACTIVE,PRIV,CLSH,500000,255000,23-06-94,Pondicherry,RoC-Pondicherry,Business Services,"NO.20, III CROSS STREETJEYA NAGAR, REDDIARPALAYAM PONDICHERRY 10. Pondicherry INDIA 605010",Indian Non-Government Company
U26299PY1994PTC000979,PONDY PREMIER SEALS PRIVATE LIMITED,ACTIVE,PRIV,CLSH,500000,100000,17-06-94,Pondicherry,RoC-Pondicherry,NA,"118, THIRUVALLUVAR SALAI,(SECOND FLOOR), PONDICHERRY 605 013. Pondicherry INDIA",Indian Non-Government Company
U01118PY1994PTC000980,PONDY AGRO STABILIZERS PRIVATE LIMITED,ACTIVE,PRIV,CLSH,100000,100000,29-06-94,Pondicherry,RoC-Pondicherry,Agriculture and Allied Activities,46 BHARATHI NAGARLAWSPET PONDICHERRY Pondicherry INDIA,Indian Non-Government Company
U99999PY1994PTC000981,SRI DHANALAKSHMI ENGINEERING FABRICATION WORKS PRIVATE LIMITED,STRIKE OFF,PRIV,CLSH,500000,NA,30-06-94,Pondicherry,RoC-Pondicherry,NA,60 CALVE BUNGALOWPONDICHERRY 605 011 Pondicherry INDIA,Indian Non-Government Company
U74900PY1994PLC000982,SOURCE NATURELLE PONDICHERY LIMITED,STRIKE OFF,PUBC,CLSH,1000000,52000,30-06-94,Pondicherry,RoC-Pondicherry,Business Services,"31, Ellamman Koil St., PONDICHERRY 605 001 Pondicherry INDIA 605001",Indian Non-Government Company
U99999PY1994PTC000983,INDIAN FRESH FRUITS AND VEGETABLES EXPORTS PRIVATE LIMITED,STRIKE OFF,PRIV,CLSH,100000,NA,30-06-94,Pondicherry,RoC-Pondicherry,NA,74 PERUMAL NAIDU STREETMUTHIALPET PONDICHERRY 605 003 Pondicherry INDIA,Indian Non-Government Company
U74900PY1994PTC000985,ABHINAV EXIM (MADRAS) P. LTD,ACTIVE,PRIV,CLSH,7500000,100000,13-07-94,Pondicherry,RoC-Pondicherry,Business Services,"DOOR NO 1, ABIRAMI AMMAN WEST STREET T.R.PATTINAM KARAIKKAL Pondicherry INDIA 609606",Indian Non-Government Company
U31909PY1994PTC000986,USHA INFORMATICS PRIVATE LIMITED,ACTIVE,PRIV,CLSH,25000000,18663500,14-07-94,Pondicherry,RoC-Pondicherry,Manufacturing (Machinery & Equipments),"NO.2, BIG BELL STREET KAMARAJ SALAI PONDICHERRY Pondicherry INDIA 605013",Indian Non-Government Company
U21012PY1994PTC000987,BOB'S PAPERS PRIVATE LIMITED,ACTIVE,PRIV,CLSH,500000,100000,15-07-94,Pondicherry,RoC-Pondicherry,"Manufacturing (Paper & Paper products, Publishing, printing and reproduction of recorded media)",PLOT NO.4 VENKATA NAGAR EXTNPONDICHERRY 605 011 PONDICHERRY 605 011 Pondicherry INDIA 605011,Indian Non-Government Company
U74900PY1994PTC000990,SUNTEC (INDIA) PRIVATE LIMITED,STRIKE OFF,PRIV,CLSH,500000,25000,26-07-94,Pondicherry,RoC-Pondicherry,Business Services,NO.4 SCHOOL STREETALLANKUPPAM PONDICHERRY Pondicherry INDIA,Indian Non-Government Company
U65992PY1994PTC000991,BHAGYALAKSHMI CHITS PRIVATE LIMITED,ACTIVE,PRIV,CLSH,300000,300000,28-07-94,Pondicherry,RoC-Pondicherry,Finance,"NO. 221, M.G. ROAD, 2ND FLOOR PONDICHERRY Pondicherry INDIA 605001",Indian Non-Government Company
U15412PY1994PTC000992,VELL BISCUITS PRIVATE LIMITED,ACTIVE,PRIV,CLSH,25000000,22625000,29-07-94,Pondicherry,RoC-Pondicherry,Manufacturing (Food stuffs),"R. S. NO. 4/5 & 4/1 A2, SANYA-SIKUPPAM ROAD THIRUBUVANAI, PONDICHERRY - 605 107 PONDICHERRY - 605 107 Pondicherry INDIA 605107",Indian Non-Government Company
U99999PY1994PTC000994,MANICKAM CARRIERS PRIVATE LIMITED,STRIKE OFF,PRIV,CLSH,500000,100000,08-09-94,Pondicherry,RoC-Pondicherry,NA,VAZHUDAVUR ROADMUTHIRAPALAYAM PONDICHERRY Pondicherry INDIA,Indian Non-Government Company
U60231PY1994PLC000995,PONSUM FARMERS BENEFIT FUND LIMITED,STRIKE OFF,PUBC,CLSH,2600000,2533784,19-08-94,Pondicherry,RoC-Pondicherry,"Transport, storage and Communications",11 NATESAN NAGARPONDICHERRY PIN; 605 005 PIN; 605 005 Pondicherry INDIA 605005,Indian Non-Government Company
U99999PY1994PTC000996,KARAIKAL SILICATES PVT. LTD.,STRIKE OFF,PRIV,CLSH,300000,NA,24-08-94,Pondicherry,RoC-Pondicherry,NA,"16, 4TH CROSS, JAYA NAGARPONDICHERRY 10 Pondicherry INDIA",Indian Non-Government Company
U70101PY1994PTC000997,ETABLISSEMENT MOUNEN BUILDERS PVT. LTD,STRIKE OFF,PRIV,CLSH,1000000,100200,29-08-94,Pondicherry,RoC-Pondicherry,NA,"NO.111,113 GINGEE SALAI,PONDICHERRY. Pondicherry INDIA",Indian Non-Government Company
U99999PY1994PTC000998,HOT BREAD EXPORTS INDIA PVT. LTD,STRIKE OFF,PRIV,CLSH,2500000,NA,29-08-94,Pondicherry,RoC-Pondicherry,NA,"31 MAIN ROAD, NATESAN NAGARPONDICHERRY PIN 605 005 Pondicherry INDIA",Indian Non-Government Company
