CIN,COMPANY_NAME,COMPANY_STATUS,COMPANY_CLASS,COMPANY_CATEGORY,AUTHORIZED_CAPITAL,PAIDUP_CAPITAL,DATE_OF_REGISTRATION,REGISTERED_STATE,ROC,DESCRIPTION,REGISTERED_OFFICE_ADDRESS,SUB_CATEGORY
U17200PY2002PTC001640,RAGHURAJ INDUSTRIES PRIVATE LIMITED,ACTIVE,PRIV,CLSH,10000000,100000,22-03-02,Pondicherry,RoC-Pondicherry,Manufacturing (Textiles),"41-B, THULUKANATHAMMAN KOVIL STREET THIRUVALLUVAR NAGAR PUDUCHERRY Pondicherry INDIA 605003",Indian Non-Government Company
U25199PY2002PTC001641,SUN FOAMS PRIVATE LIMITED,DORMANT,PRIV,CLSH,100000,100000,26-03-02,Pondicherry,RoC-Pondicherry,"Manufacturing (Metals & Chemicals, and products thereof)","NO.113,MAIN ROAD,RS.NO.104/20,SEDARAPOST VIA AUROVILLE, VILLIANUR COMMUNE,PONDICHERRY PONDICHERRY - 605 111 Pondicherry INDIA 605111",Indian Non-Government Company
U51909PY2002PTC001642,FAIR DEAL NETWORLD MARKETING PRIVATE LIMITED,STRIKE OFF,PRIV,CLSH,100000,100000,26-03-02,Pondicherry,RoC-Pondicherry,Trading,"NO.17, IST MAIN ROAD,AVVAI NAGAR, LAWSPET, PONDICHERRY - 605 008 PONDICHERRY - 605 008 Pondicherry INDIA 605008",Indian Non-Government Company
U24239PY2002PTC001643,BALAJI HERBAL BIO-TEK PRIVATE LIMITED,STRIKE OFF,PRIV,CLSH,500000,100000,04-04-02,Pondicherry,RoC-Pondicherry,"Manufacturing (Metals & Chemicals, and products thereof)","A-49 TO A-54 & A-64 TO A-69 PIPDIC INDUSTRIAL ESTATE, SEDARAPET - 605 101 PONDICHERRY - 605 101 Pondicherry INDIA 605101",Indian Non-Government Company
U22122PY2002PTC001644,PROFESSIONAL YELLOW PAGES PRIVATE LIMITED,DORMANT,PRIV,CLSH,100000,100000,04-10-02,Pondicherry,RoC-Pondicherry,"Manufacturing (Paper & Paper products, Publishing, printing and reproduction of recorded media)","109, IST FLOOR, ARCH ROAD,V.V.P.NAGAR THATTANCHAVADY, PONDICHERRY - 605 009 PONDICHERRY - 605 009 Pondicherry INDIA 605009",Indian Non-Government Company
U50101PY2002PTC001645,A.M.CARS PRIVATE LIMITED,ACTIVE,PRIV,CLSH,300000,300000,17-04-02,Pondicherry,RoC-Pondicherry,Trading,"T.S.NO.12/5,100 FEET ROAD,OPP.R.T.O. OFFICE O.K.PALAYAM, MUDALIARPET, PONDICHERRY -4 PONDICHERRY - 605 004 Pondicherry INDIA 605004",Indian Non-Government Company
U50101PY2002PTC001647,HASAN ASSOCIATES PRIVATE LIMITED,ACTIVE,PRIV,CLSH,5000000,4200000,29-04-02,Pondicherry,RoC-Pondicherry,Trading,"NO.1, SUBBAI SALAI,PONDICHERRY, PINCODE - 605 001 PONDICHERRY- 605 001 Pondicherry INDIA 605001",Indian Non-Government Company
U74300PY2002PTC001648,LOOKIT YELLOWPAGES PRIVATE LIMITED,ACTIVE,PRIV,CLSH,100000,100000,06-04-02,Pondicherry,RoC-Pondicherry,Business Services,"26-C,1ST.FLOOR,LENIN STREET,KOSAPALAYAM PONDICHERRY 605013 Pondicherry INDIA 605013",Indian Non-Government Company
U51909PY2002PTC001649,ADAVAN MULTILEVEL MARKETING PRIVATE LIMITED.,STRIKE OFF,PRIV,CLSH,100000,100000,20-06-02,Pondicherry,RoC-Pondicherry,Trading,"NO.4,MARIAMMAN KOIL STREET,ARUMPARTHAPURAM, PONDICHERY - 605 110 PONDICHERRY - 605 110 Pondicherry INDIA 605110",Indian Non-Government Company
U74993PY2002PTC001650,SHREE MAHAGANAPATHY GRAND DIGITAL IMAGING PRIVATE LIMITED.,STRIKE OFF,PRIV,CLSH,2000000,2000000,15-07-02,Pondicherry,RoC-Pondicherry,Business Services,NO.303 MARAIMALAI ADIGALSALAIPONDICHERRY - 605 005 PONDICHERRY - 605 005 Pondicherry INDIA 605005,Indian Non-Government Company
U24112PY2002PLC001651,PONDICHERRY ALUM AND CHEMICALS LIMITED,ACTIVE,PUBC,CLSH,10000000,10000000,16-07-02,Pondicherry,RoC-Pondicherry,"Manufacturing (Metals & Chemicals, and products thereof)","NO.1,CHURCH STREET,REDDIAR PALAYAM, PONDICHERRY - 605 010 PONDICHERRY - 605 010 Pondicherry INDIA 605010",Indian Non-Government Company
U29192PY2002PTC001652,ZEN AIRCONDITIONERS PRIVATE LIMITED,DORMANT,PRIV,CLSH,100000,100000,22-07-02,Pondicherry,RoC-Pondicherry,Manufacturing (Machinery & Equipments),"NO.22,YAMUNAI STREET,VASANTH NAGAR, MUTHIALPET,PONDICHERR -605003 PONDICHERRY - 605 003 Pondicherry INDIA 605003",Indian Non-Government Company
U51410PY2002PTC001653,TASLINA PETRO OIL PRIVATE LIMITED,STRIKE OFF,PRIV,CLSH,600000,600000,22-07-02,Pondicherry,RoC-Pondicherry,Trading,"NO.1,MAMATHAMBIMARICAR STREET,KARAIKKAL PONDICHERRY - 609602 KARAIKKAL - 609 602 Pondicherry INDIA 609602",Indian Non-Government Company
U58211PY2002PTC001654,ADITHYA FERRO ALLOYS PRIVATE LIMITED,ACTIVE,PRIV,CLSH,15000000,15000000,25-07-02,Pondicherry,RoC-Pondicherry,NA,"242/1, SURAKUDI VILLAGE,THIRUNALLAR COMMUNE, KARAIKKAL - 609 607 KARAIKKAL - 609 607 Pondicherry INDIA 609607",Indian Non-Government Company
U91990PY2002NPL001656,GOLDEN AGE FOUNDATION,ACTIVE,PRIV,CLSH,100000,20000,23-08-02,Pondicherry,RoC-Pondicherry,"Community, personal & Social Services","NO.69,VILLANUR MAIN ROAD,REDDIAR PALAYAM, PONDICHERRY.PIN-605010. PONDICHERRY 605 010. Pondicherry INDIA 605010",Company licensed under Section25
U05004PY2002PTC001657,P.R.N. AQUA FARMS PRIVATE LIMITED.,ACTIVE,PRIV,CLSH,200000,200000,26-08-02,Pondicherry,RoC-Pondicherry,Agriculture and Allied Activities,"50,BHARATHIAR ROADKOTTUCHERRY KARAIKAL-609 609 Pondicherry INDIA 609609",Indian Non-Government Company
U51909PY2002PTC001658,ARUL IMPEX PRIVATE LIMITED.,STRIKE OFF,PRIV,CLSH,200000,200000,09-04-02,Pondicherry,RoC-Pondicherry,Trading,"NO 210,SUBBAIAH NAGARPONDICHERRY. PONDICHERRY-605 009 Pondicherry INDIA 605009",Indian Non-Government Company
U25209PY2002PTC001659,EUROPA HEALTH SYSTEMS PRIVATE LIMITED,STRIKE OFF,PRIV,CLSH,100000,100000,09-11-02,Pondicherry,RoC-Pondicherry,"Manufacturing (Metals & Chemicals, and products thereof)","HOUSE NO.44, III CROSS,KOTHAVARI STREET VALLALARNAGAR NAINARMANDAPAM,PONDICHERRY 4 PONDICHERRY 605 004 Pondicherry INDIA 605004",Indian Non-Government Company
U15513PY2002PTC001660,ASHWIN AQUA FOODS AND BEVERAGES PRIVATE LIMITED,STRIKE OFF,PRIV,CLSH,2000000,2000000,09-11-02,Pondicherry,RoC-Pondicherry,NA,"27,NINTH CROSSBRINDAVAN COLONY, PONDICHERRY-605 013. PONDICHERRY-605 013. Pondicherry INDIA 605013",Indian Non-Government Company
U01131PY2002PTC001661,NTS ESTATES PRIVATE LIMITED,ACTIVE,PRIV,CLSH,10000000,5000000,16-09-02,Pondicherry,RoC-Pondicherry,Agriculture and Allied Activities,"NO.211,CHETTY STREET,PONDICHERRY - 605 001 PONDICHERRY 605 001 Pondicherry INDIA 605001",Indian Non-Government Company
U01131PY2002PTC001662,SRI VEDAPUREESWARAR ESTATES AND AGRO FARMING INDIA PVT LTD,ACTIVE,PRIV,CLSH,500000,450000,16-09-02,Pondicherry,RoC-Pondicherry,Agriculture and Allied Activities,"NO.54, ESWARAN KOIL STREET,PONDICHERRY - 605 001 PONDICHERRY - 605 001 Pondicherry INDIA 605001",Indian Non-Government Company
U55101PY2002PTC001663,JAY HOTELS AND TRAVELS PRIVATE LIMITED,ACTIVE,PRIV,CLSH,500000,100000,16-09-02,Pondicherry,RoC-Pondicherry,Trading,36 SIRUNDERI MUTT ROAD100 FT ROAD ELLAPILLAI CHAVADI PONDICHERRY - 605 005 Pondicherry INDIA 605005,Indian Non-Government Company
U26959PY2002PTC001664,RPM TECHNOLOGIES PRIVATE LIMITED,ACTIVE,PRIV,CLSH,500000,150000,18-09-02,Pondicherry,RoC-Pondicherry,"Manufacturing (Metals & Chemicals, and products thereof)","41, 2ND STREET,VENKATA NAGAR, PONDICHERRY - 605 011 PONDICHERRY - 605 011 Pondicherry INDIA 605011",Indian Non-Government Company
U40109PY2002PTC001665,NORTHERNN POWER AND TELECOMS PRIVATE LIMITED,DORMANT,PRIV,CLSH,500000,500000,23-09-02,Pondicherry,RoC-Pondicherry,"Electricity, Gas & Water companies","21/2, MYLAM ROAD,SEDARAPET, PONDICHERRY - 6-5 111 PONDICHERRY - 605 111 Pondicherry INDIA 605111",Indian Non-Government Company
U51909PY2002PTC001666,UNITED PEST AND INSECT CONTROL GROUP (I)PRIVATE LIMITED.,STRIKE OFF,PRIV,CLSH,500000,500000,30-09-02,Pondicherry,RoC-Pondicherry,Trading,"NO.17,POOKAARA STREETMUTHIALPET PONDICHERRY-605 003 PONDICHERRY-605 003 Pondicherry INDIA 605003",Indian Non-Government Company
U02429PY2002PTC001668,KAMAKSHI CHEMICALS PRIVATE LIMITED,ACTIVE,PRIV,CLSH,1000000,1000000,10-10-02,Pondicherry,RoC-Pondicherry,NA,"RS.NO.57/3/D,NAINIKATTALAI ROAD,POLAGAM, T.R.PATTINAM COMMUNE KARAIKAL-609 606 Pondicherry INDIA 609606",Indian Non-Government Company
U60231PY2002PTC001669,GBT WIZ LOGISTICS PRIVATE LIMITED,STRIKE OFF,PRIV,CLSH,100000,100000,30-10-02,Pondicherry,RoC-Pondicherry,"Transport, storage and Communications","26, LENIN STREET,KOSAPALAYAM, PONDICHERRY 605 013. PONDICHERRY-605 013 Pondicherry INDIA 605013",Indian Non-Government Company
U63031PY2002PTC001670,SHRI KRISHNA CAR RENTALS PRIVATE LIMITED,STRIKE OFF,PRIV,CLSH,200000,200000,31-10-02,Pondicherry,RoC-Pondicherry,"Transport, storage and Communications","2,MARIUS XAVIER STREETPONDICHERRY PONDICHERRY-605001 Pondicherry INDIA 605001",Indian Non-Government Company
U51909PY2002PTC001671,SURIAA MARKFED PRIVATE LIMITED,DORMANT,PRIV,CLSH,100000,100000,11-01-02,Pondicherry,RoC-Pondicherry,Trading,"K.R.COMPLEX, SUNDARARAJ NAGAR,100 FEET ROAD MUDALIARPET, PONDICHERRY 605 004. PONDICHERRY 605 001. Pondicherry INDIA 605001",Indian Non-Government Company
U51909PY2002PTC001672,VALUE WINGS ENTERPRISES PRIVATE LIMITED,ACTIVE,PRIV,CLSH,1000000,200000,11-06-02,Pondicherry,RoC-Pondicherry,Trading,"NO.8, SECOND FLOOR, SIXTH CROSS, SATHYA NAGAR, PUDUCHERRY Pondicherry INDIA 605013",Indian Non-Government Company
U51219PY2002PTC001673,UNIMAX AGRO MARKETING PRIVATE LIMITED,STRIKE OFF,PRIV,CLSH,100000,100000,18-11-02,Pondicherry,RoC-Pondicherry,Trading,"NO.245, THIRUVALLUVAR SALAI,(UPSTAIRS) PILLAITHOTTAM, PONDICHERRY-13. PONDICHERRY 605 013. Pondicherry INDIA 605013",Indian Non-Government Company
U25209PY2002PTC001674,ACT PLASTIC PRIVATE LTD,ACTIVE,PRIV,CLSH,300000,300000,20-11-02,Pondicherry,RoC-Pondicherry,"Manufacturing (Metals & Chemicals, and products thereof)","NO.1,3RD CROSS,RAMANPURAM PONDICHERRY-605 009. Pondicherry INDIA 605009",Indian Non-Government Company
U72200PY2002PTC001675,ARROW TECHNOLOGIES PRIVATE LIMITED,ACTIVE,PRIV,CLSH,1100000,1100000,20-11-02,Pondicherry,RoC-Pondicherry,Business Services,"NO.24,THIRUMAL NAGARPONDICHERRY 605 013. P0NDICHERRY-605 013. Pondicherry INDIA 605013",Indian Non-Government Company
U24247PY2002PTC001676,CARISTA HERBAL PRODUCTS PRIVATE LIMITED,ACTIVE,PRIV,CLSH,2000000,1800000,22-11-02,Pondicherry,RoC-Pondicherry,"Manufacturing (Metals & Chemicals, and products thereof)","B-48/49/50PIPDIC INDUSTRIAL ESTATE SEDARAPATTU,PONDICHERRY. PONDICHERRY-605 111. Pondicherry INDIA 605111",Indian Non-Government Company
U64202PY2002PTC001677,TCP INTERNATIONAL PRIVATE LIMITED,ACTIVE,PRIV,CLSH,5000000,2527890,25-11-02,Pondicherry,RoC-Pondicherry,"Transport, storage and Communications","56, KONDA REDDY STREET,REDDIYAR PALAYAM, PONDICHERRY 605 010. PONDICHERRY 605 010. Pondicherry INDIA 605010",Indian Non-Government Company
U72900PY2002PTC001678,SURMOUNT TECHNOLOGIES PRIVATE LIMITED,STRIKE OFF,PRIV,CLSH,100000,100000,25-11-02,Pondicherry,RoC-Pondicherry,Business Services,"166-A, HOUSING BOARD COMPLEX,KURUMBAPET, PONDICHERRY 605 009. PONDICHERRY 605 009. Pondicherry INDIA 605009",Indian Non-Government Company
U41000PY2002PTC001679,SUN REAL WATER SUPPLIERS PRIVATE LIMITED,STRIKE OFF,PRIV,CLSH,100000,100000,27-11-02,Pondicherry,RoC-Pondicherry,"Electricity, Gas & Water companies","37, LENIN STREET,KUYAVARPALAYAM, PONDICHERRY 605 013. PONDICHERRY 605 013. Pondicherry INDIA 605013",Indian Non-Government Company
U15412PY2002PTC001680,TRILION FOODS PRIVATE LIMITED,STRIKE OFF,PRIV,CLSH,500000,100000,29-11-02,Pondicherry,RoC-Pondicherry,Manufacturing (Food stuffs),"NO.3, MONTROSIER STREET,PONDICHERRY 605 001. PONDICHERRY 605 001. Pondicherry INDIA 605001",Indian Non-Government Company
U51909PY2002PTC001681,UV TRADING PRIVATE LIMITED,STRIKE OFF,PRIV,CLSH,100000,100000,13-12-02,Pondicherry,RoC-Pondicherry,Trading,"NO.90,DR.SARTHAR VALLABHAIPATEL ROAD.PONDICHERRY-605 001 PONDICHERRY-605 001 Pondicherry INDIA 605001",Indian Non-Government Company
U51311PY2002PTC001682,RAVENBUCK EXPORT PRIVATE LIMITED,STRIKE OFF,PRIV,CLSH,100000,100000,19-12-02,Pondicherry,RoC-Pondicherry,Trading,"NO.22,RUE DE LAURISTON,PONDICHERRY PONDICHERRY-605 001. Pondicherry INDIA 605001",Indian Non-Government Company
U60231PY2003PLC001683,L.G.M.LOGISTICS LIMITED,STRIKE OFF,PUBC,CLSH,1000000,1000000,01-02-03,Pondicherry,RoC-Pondicherry,"Transport, storage and Communications","NO.18,VENKATESHWARA NAGAR EASTPUDUSARAM PONDICHERRY-605 013. PONDICHERRY-605 013 Pondicherry INDIA 605013",Indian Non-Government Company
U74999PY2003PTC001684,ISHA FOREX PRIVATE LIMITED,ACTIVE,PRIV,CLSH,2600000,2600000,14-01-03,Pondicherry,RoC-Pondicherry,Business Services,"NO330, ANNA SALAI,PONDICHERRY-605001 PONDICHERRY-605 001. Pondicherry INDIA 605001",Indian Non-Government Company
U45201PY2003PTC001685,JAN BUILD PRIVATE LIMITED,DORMANT,PRIV,CLSH,100000,100000,14-01-03,Pondicherry,RoC-Pondicherry,Construction,"NO.20,IST CROSSGANAPATHY NAGAR,MUTHIALPET PONDICHERRY-605 003. Pondicherry INDIA 605003",Indian Non-Government Company
U72200PY2003PTC001686,PLATINUM INFOSYSTEMS PRIVATE LIMITED,ACTIVE,PRIV,CLSH,100000,100000,30-01-03,Pondicherry,RoC-Pondicherry,Business Services,"SOMA, 45, IV CROSS, SATYA NAGAR PONDICHERRY Pondicherry INDIA 605013",Indian Non-Government Company
U72200PY2003PTC001687,CR COMPUTER SOLUTIONS PRIVATE LIMITED,ACTIVE,PRIV,CLSH,100000,100000,31-01-03,Pondicherry,RoC-Pondicherry,Business Services,"I FLOOR,115, AUROBINDO STREET, PONDICHERRY-605001. PONDICHERRY-605001. Pondicherry INDIA 605001",Indian Non-Government Company
U34300PY2003PTC001689,SUPREME AUTOMECH (INDIA) PRIVATE LIMITED,ACTIVE,PRIV,CLSH,6000000,6000000,18-02-03,Pondicherry,RoC-Pondicherry,Manufacturing (Machinery & Equipments),"R.S.NO.74/2b, MADUKARAI MAIN ROAD, MANGALAM VILLIANUR COMMUNE PONDICHERRY Pondicherry INDIA 605110",Indian Non-Government Company
U74999PY2003PTC001690,KUBERAN CHITS (PONDY)PRIVATE LIMITED,ACTIVE,PRIV,CLSH,200000,200000,03-04-03,Pondicherry,RoC-Pondicherry,Business Services,"NO.198, RANGAPILLAI STREET,PONDICHERRY-605001. PONDICHERRY-605001. Pondicherry INDIA 605001",Indian Non-Government Company
U60210PY2003PTC001691,ARUNACHALA TRANSPORTS PRIVATE LIMITED,STRIKE OFF,PRIV,CLSH,100000,100000,18-03-03,Pondicherry,RoC-Pondicherry,"Transport, storage and Communications","NO.11, GOVINDASALAI MAIN ROAD,BHARATHIPURAM, PONDICHERRY-605001. PONDICHERRY-605001. Pondicherry INDIA 605001",Indian Non-Government Company
U60210PY2003PTC001692,SRI MITHRA TRANSPORT PRIVATE LIMITED,DORMANT,PRIV,CLSH,100000,100000,18-03-03,Pondicherry,RoC-Pondicherry,"Transport, storage and Communications","NO.52, M.G. ROAD,PONDICHERRY-605001. PONDICHERRY-605001. Pondicherry INDIA 605001",Indian Non-Government Company
U60210PY2003PTC001693,KEERTHANA TRANSPORT PRIVATE LIMITED,STRIKE OFF,PRIV,CLSH,300000,300000,18-03-03,Pondicherry,RoC-Pondicherry,"Transport, storage and Communications","NO.23, NARAYANA DOSS STREET,KAMARAJ NAGAR, PONDICHERRY-605001. PONDICHERRY-605001. Pondicherry INDIA 605001",Indian Non-Government Company
U60210PY2003PTC001694,GNANAKANDAN TRAVELS PRIVATE LIMITED,STRIKE OFF,PRIV,CLSH,150000,150000,18-03-03,Pondicherry,RoC-Pondicherry,"Transport, storage and Communications","NO.37, BAHOUR ROAD,URUVAIYAR, VILLIANUR VIA, PONDICHERRY-605110 605110. Pondicherry INDIA 605110",Indian Non-Government Company
U60210PY2003PTC001695,G.K. BROS. TRANSPORT PRIVATE LIMITED,STRIKE OFF,PRIV,CLSH,300000,300000,18-03-03,Pondicherry,RoC-Pondicherry,"Transport, storage and Communications","NO.16, THILLAI NAGAR,MUDALIARPET, PONDICHERRY-605004. PONDICHERRY-605004. Pondicherry INDIA 605004",Indian Non-Government Company
U60210PY2003PTC001696,SELVAPRAVIN TRAVELS PRIVATE LIMITED,STRIKE OFF,PRIV,CLSH,150000,100000,21-03-03,Pondicherry,RoC-Pondicherry,"Transport, storage and Communications","10,KALYANA SUNDARAM STREETANANDHA NAGAR KATHIRKAMAM PONDICHERRY-605 009 Pondicherry INDIA 605009",Indian Non-Government Company
U72300PY2003PTC001697,VICTORY ESERVICES PRIVATE LIMITED,ACTIVE,PRIV,CLSH,300000,275000,04-09-03,Pondicherry,RoC-Pondicherry,Business Services,"18, 8th Cross, II Floor, Subbiah Nagar PONDICHERRY-605 001 Pondicherry INDIA 605007",Indian Non-Government Company
U01212PY2003NPL001698,REAL WOMEN DAIRY DEVELOPMENT,DORMANT,PRIV,CLAG,0,0,04-10-03,Pondicherry,RoC-Pondicherry,Agriculture and Allied Activities,"NO.189,PILLAIYAR KOIL STREETVELMURUGAN NAGAR KOSAPALAYAM, PONDICHERRY PONDICHERRY Pondicherry INDIA 605013",Company licensed under Section25
U33201PY2003PTC001699,EYE PHOTONICS (INDIA) PRIVATE LIMITED,ACTIVE,PRIV,CLSH,1000000,120000,04-11-03,Pondicherry,RoC-Pondicherry,Manufacturing (Machinery & Equipments),"NO.86&87,IIND CROSS STREETPOON NAGAR PONDICHERRY-605 005 PONDICHERRY-5 Pondicherry INDIA 605005",Indian Non-Government Company
U15142PY2003PTC001700,PONDY EDIBLES PRIVATE LIMITED,DORMANT,PRIV,CLSH,100000,100000,16-04-03,Pondicherry,RoC-Pondicherry,Manufacturing (Food stuffs),"NO.40, PSC BANK NAGAR,II FLOOROPP.RTO OFFICE MUDALIARPET, PONDICHERRY-605004. 605004. Pondicherry INDIA 605004",Indian Non-Government Company
U31909PY2003PTC001701,J TECHNO PALACE PRIVATE LIMITED,STRIKE OFF,PRIV,CLSH,100000,100000,16-04-03,Pondicherry,RoC-Pondicherry,Manufacturing (Machinery & Equipments),"NO.20, 3RD CROSS,SUNDER RAJA NAGAR, 100FT.ROAD, BHOOMIANPET, PONDICHERRY-5. 605005. Pondicherry INDIA 605005",Indian Non-Government Company
U55101PY2003PTC001702,VENUGOPAL INN PRIVATE LIMITED,ACTIVE,PRIV,CLSH,5000000,5000000,16-04-03,Pondicherry,RoC-Pondicherry,Trading,"NO.240, JAWAHARLAL NEHRU ST.,PONDICHERRY-605001. 605001. Pondicherry INDIA 605001",Indian Non-Government Company
U70109PY2003PTC001703,SRI VEDHAA CREATIONS PRIVATE LIMITED,ACTIVE,PRIV,CLSH,100000,100000,30-04-03,Pondicherry,RoC-Pondicherry,Real Estate and Renting,"NO.50,VELLALAR STREETPONDICHERRY PONDICHERRY-605 001. Pondicherry INDIA 605001",Indian Non-Government Company
U74999PY2003PTC001704,AMRITA ENTERPRISES PRIVATE LIMITED,ACTIVE,PRIV,CLSH,60000000,44161800,05-01-03,Pondicherry,RoC-Pondicherry,Business Services,"NO.42, BHARATHIAR STREET, ASHOK NAGAR, PUDUCHERRY Pondicherry INDIA 605008",Indian Non-Government Company
U45201PY2003PTC001705,APARAJITHA HOUSING AND MARKETING PRIVATE LIMITED,STRIKE OFF,PRIV,CLSH,100000,100000,05-02-03,Pondicherry,RoC-Pondicherry,Construction,"NO.81, PATCHAI VAZHAI AMMANKOIL ST., VAITHIKUPPAM, PONDICHERRY-605012. 605012. Pondicherry INDIA 605012",Indian Non-Government Company
U15543PY2003PTC001706,S.M.AQUA VIVA PRIVATE LIMITED,DORMANT,PRIV,CLSH,100000,100000,13-05-03,Pondicherry,RoC-Pondicherry,Manufacturing (Food stuffs),"NO.2, VILLIANUR ROAD,MURUNGAPAKKAM, PONDICHERRY-605004. 605004. Pondicherry INDIA 605004",Indian Non-Government Company
U55101PY2003PTC001708,SANTA PONSA RESORTS PRIVATE LIMITED,STRIKE OFF,PRIV,CLSH,500000,500000,28-05-03,Pondicherry,RoC-Pondicherry,Trading,"NO.27, NEW STREET,BARATHIPURAM, PONDICHERRY-605011. 605011. Pondicherry INDIA 605011",Indian Non-Government Company
U60210PY2003PTC001709,ISWARIYAM TRAVEL SERVICES PRIVATE LIMITED,STRIKE OFF,PRIV,CLSH,100000,100000,06-04-03,Pondicherry,RoC-Pondicherry,"Transport, storage and Communications","NO.111, EAST MAIN ROAD,THANTHAI PERIYAR NAGAR, ELLAIPILLAICHAVADI, PONDY-5 605005. Pondicherry INDIA 605005",Indian Non-Government Company
U24117PY2003PTC001710,SRI CHENTHOORAN SODIUM PLANT PRIVATE LIMITED,DORMANT,PRIV,CLSH,1000000,1000000,06-12-03,Pondicherry,RoC-Pondicherry,"Manufacturing (Metals & Chemicals, and products thereof)","R.S.NO.563, KEELAVANJORE,THIRUMALAIRAYANPATTINAM, KARAIKAL-609606. 609606. Pondicherry INDIA 609606",Indian Non-Government Company
U51216PY2003PTC001711,SALSA TRADING (INDIA) PRIVATE LIMITED,ACTIVE,PRIV,CLSH,1000000,100000,06-12-03,Pondicherry,RoC-Pondicherry,Trading,"10, ST. MARTIN STREET,PONDICHERRY-605001. 605001. Pondicherry INDIA 605001",Indian Non-Government Company
U60210PY2003PTC001712,M.K.M. TRANSPORT PRIVATE LIMITED,STRIKE OFF,PRIV,CLSH,100000,100000,24-06-03,Pondicherry,RoC-Pondicherry,"Transport, storage and Communications","NO.22, II CROSS,THILAGAR NAGAR, PONDICHERRY-605009. 605009. Pondicherry INDIA 605009",Indian Non-Government Company
U92132PY2003PTC001713,MEGABYTES INDIA PRIVATE LIMITED,ACTIVE,PRIV,CLSH,1000000,950000,27-06-03,Pondicherry,RoC-Pondicherry,"Community, personal & Social Services","NO.50, FIRST FLOOR, MISSION STREET PONDICHERRY Pondicherry INDIA 605001",Indian Non-Government Company
U51909PY2003PTC001714,SELVA'S MARKETING PRIVATE LIMITED,STRIKE OFF,PRIV,CLSH,500000,450000,07-04-03,Pondicherry,RoC-Pondicherry,Trading,"NO.303, M.G. ROAD,PONDICHERRY-605001. 605001. Pondicherry INDIA 605001",Indian Non-Government Company
U60210PY2003PTC001715,ANNAMALAIYAR TRANSPORT PRIVATE LIMITED,STRIKE OFF,PRIV,CLSH,100000,100000,07-08-03,Pondicherry,RoC-Pondicherry,"Transport, storage and Communications","NO.6, MANAKULAVINAYAGAR STREETJAYAM NAGAR MUDALIARPET, [PMDOCJERRU-605004. 605004. Pondicherry INDIA 605004",Indian Non-Government Company
U74140PY2003PTC001717,SOURCE TECHNOLOGY SYSTEMS INDIA PRIVATE LIMITED,ACTIVE,PRIV,CLSH,500000,100000,18-08-03,Pondicherry,RoC-Pondicherry,Business Services,"ASHIRWAD NO.13 & 15, KALATHEESWARAN KOIL STREET (CHETTY STREET), GROUND FLOOR PONDICHERRY Pondicherry INDIA 605001",Indian Non-Government Company
U65992PY2003PTC001718,PONDICHERRY ANBU CHITS PRIVATE LIMITED,ACTIVE,PRIV,CLSH,250000,140000,09-09-03,Pondicherry,RoC-Pondicherry,Finance,"NO.227, I FLOOR,CHETTY STREET, PONDICHERRY 605001. Pondicherry INDIA 605001",Indian Non-Government Company
U65999PY2003PTC001719,PRAVAG FINANCIAL SERVICES PRIVATE LIMITED,STRIKE OFF,PRIV,CLSH,150000,150000,09-10-03,Pondicherry,RoC-Pondicherry,Finance,"NO.101, II FLOOR, VYSYAL ST.,PONDICHERRY-605001. 605001. Pondicherry INDIA 605001",Indian Non-Government Company
U72200PY2003PTC001720,J P SOFTWARE SOLUTIONS PRIVATE LIMITED,STRIKE OFF,PRIV,CLSH,100000,100000,09-12-03,Pondicherry,RoC-Pondicherry,Business Services,"POPE JOHN PAUL II COLLEGE OFEDUCATION REDDIARPALAYAM, PONDICHERRY-605010. 605010. Pondicherry INDIA 605010",Indian Non-Government Company
U72200PY2003PTC001721,J EMISYS SOFTWARE AND SERVICES PRIVATE LIMITED,STRIKE OFF,PRIV,CLSH,200000,200000,09-12-03,Pondicherry,RoC-Pondicherry,Business Services,"NO.63, II CROSS,RAINBOW NAGAR, PONDICHERRY-605011. 605011. Pondicherry INDIA 605011",Indian Non-Government Company
U32109PY2003PTC001724,GATEWAY POWER SYSTEMS PRIVATE LIMITED,STRIKE OFF,PRIV,CLSH,100000,100000,10-08-03,Pondicherry,RoC-Pondicherry,Manufacturing (Machinery & Equipments),"NO.11, 3RD CROSS,NAVASAKTHI NAGAR, PONDICHERY-605009. 605009. Pondicherry INDIA 605009",Indian Non-Government Company
U45201PY2003PTC001725,SEAHORSE HOUSING AND DEVELOPMENT PRIVATE LIMITED,STRIKE OFF,PRIV,CLSH,100000,100000,13-10-03,Pondicherry,RoC-Pondicherry,Construction,"NO.59, MARIAMMAN KOIL STREET,ORLEANPET PONDICHERRY-605005. 605005. Pondicherry INDIA 605005",Indian Non-Government Company
U60210PY2003PTC001726,A.T.S. TRANSPORT PRIVATE LIMITED,STRIKE OFF,PRIV,CLSH,100000,100000,14-10-03,Pondicherry,RoC-Pondicherry,"Transport, storage and Communications","NO.37, LAZAR KOIL STREET,DIBRAPET, PONDICHERRY-605001. 605001. Pondicherry INDIA 605001",Indian Non-Government Company
U31905PY1996PLC001731,KANYAKA FINE WELD LIMITED,ACTIVE,PUBC,CLSH,16500000,10025000,01-09-96,Pondicherry,RoC-Pondicherry,Manufacturing (Machinery & Equipments),"R.S.NO83/1, NAGORE MAIN ROAD,MELAVANJORE, T,R PATTINAM, KARAIKAL-611002. 611002. Pondicherry INDIA 611002",Indian Non-Government Company
U36911PY2003PTC001732,ALDEBARAN GEMS PRIVATE LIMITED,DORMANT,PRIV,CLSH,100000,100000,30-10-03,Pondicherry,RoC-Pondicherry,Manufacturing (Others),"95,MONTOSIER STREET,PONDICHERRY-605001 PONDICHERRY-605001 Pondicherry INDIA 605001",Indian Non-Government Company
U74920PY2003PTC001733,PILOT PROTECTION FORCE PRIVATE LIMITED,ACTIVE,PRIV,CLSH,200000,100000,31-10-03,Pondicherry,RoC-Pondicherry,Business Services,"NO.495, KAMARAJ SALAIOPP.TO GOVT.WORKSHOP OLD SARAM, PONDICHERRY 605 013 Pondicherry INDIA 605013",Indian Non-Government Company
U27109PY2003PLC001734,STEEL PROFILE INDIA LIMITED,DORMANT,PUBC,CLSH,1000000,1000000,11-10-03,Pondicherry,RoC-Pondicherry,"Manufacturing (Metals & Chemicals, and products thereof)","NO.14-2A,TRINITY BUILDING,II FLOOR THANTHAI PERIYARNAGA ELLAPILLAICHAVADY PONDICHERRY 605005. Pondicherry INDIA 605005",Indian Non-Government Company
U45201PY2003PTC001735,AURO MERE CONSTRUCTIONS PRIVATE LIMITED,STRIKE OFF,PRIV,CLSH,100000,100000,14-11-03,Pondicherry,RoC-Pondicherry,Construction,"NO.3, BARATHI STREET,PONDICHERY-605001. 605001. Pondicherry INDIA 605001",Indian Non-Government Company
U27109PY1996PTC001738,ADVAIT STEEL ROLLING MILLS PRIVATE LIMITED,ACTIVE,PRIV,CLSH,6000000,5950000,03-08-96,Pondicherry,RoC-Pondicherry,"Manufacturing (Metals & Chemicals, and products thereof)","RS NO.62/6, THETHAMPAKKAM,SUTHUKENI POST MANNADIPET, PONDICHERRY Pondicherry Pondicherry INDIA 605502",Indian Non-Government Company
U74140PY2003PTC001739,BALMURA DATA SOLUTIONS PRIVATE LIMITED,STRIKE OFF,PRIV,CLSH,200000,200000,12-04-03,Pondicherry,RoC-Pondicherry,Business Services,"62-A,II FLOOR,J.N.STREET, PONDICHERRY PONDICHERRY 605001. Pondicherry INDIA 605001",Indian Non-Government Company
U33119PY2003PTC001740,MEDIFURN SYSTEMS PRIVATE LIMITED,ACTIVE,PRIV,CLSH,4500000,4044500,16-12-03,Pondicherry,RoC-Pondicherry,Manufacturing (Machinery & Equipments),"24/1, KOODAPAKKAM CANAL ROAD VAZHUTHAVUR S.O, VILLIANUR COMMUNE PONDICHERRY Pondicherry INDIA 605502",Indian Non-Government Company
U13203PY2003PTC001741,BEACH MINERALS COMPANY PONDICHERY PRIVATE LIMITED,STRIKE OFF,PRIV,CLSH,700000,700000,17-12-03,Pondicherry,RoC-Pondicherry,Mining & Quarrying,"255,THIRUNALLAR ROAD,KARAIKAL 609 602, PONDICHERRY. KARAIKAL 609 602 Pondicherry INDIA 609602",Indian Non-Government Company
U30006PY2003PTC001742,VELOCITY TECHNOLOGY PRIVATE LIMITED,ACTIVE,PRIV,CLSH,7500000,4163000,18-12-03,Pondicherry,RoC-Pondicherry,Manufacturing (Machinery & Equipments),"STERLING PLAZA,74,2ND FLOOR, CANTEEN STREET, PONDICHERRY 605 001. PONDICHERRY 605 001. Pondicherry INDIA 605001",Indian Non-Government Company
