CIN,COMPANY_NAME,COMPANY_STATUS,COMPANY_CLASS,COMPANY_CATEGORY,AUTHORIZED_CAPITAL,PAIDUP_CAPITAL,DATE_OF_REGISTRATION,REGISTERED_STATE,ROC,DESCRIPTION,REGISTERED_OFFICE_ADDRESS,SUB_CATEGORY
U55101PY2009PTC002256,ARGONAUTS TOURISM PRIVATE LIMITED,STRIKE OFF,PRIV,CLSH,100000,100000,20-01-09,Pondicherry,RoC-Pondicherry,Trading,"86, CANTEEN STREET PONDICHERRY Pondicherry INDIA 605001",Indian Non-Government Company
U65999PY2009PTC002258,SHREE FOREX & TRAVELS PRIVATE LIMITED,ACTIVE,PRIV,CLSH,2700000,2700000,29-01-09,Pondicherry,RoC-Pondicherry,Finance,No. 54 MISSION STREET PONDICHERRY Pondicherry INDIA 605001,Indian Non-Government Company
U51397PY2009PTC002257,HORIZON LIFE MED PRIVATE LIMITED,ACTIVE,PRIV,CLSH,400000,350000,28-01-09,Pondicherry,RoC-Pondicherry,Trading,"15, Ist Cross Street, Kundupalyam, Thattanchavady Pondicherry Pondicherry INDIA 605009",Indian Non-Government Company
U72900PY2009PTC002262,VENKI DESIGNS PRIVATE LIMITED,ACTIVE,PRIV,CLSH,100000,100000,02-09-09,Pondicherry,RoC-Pondicherry,Business Services,"NO 2 (OLD NO 10A), INDIRA GANDHI STREET, ORLEANPET Pondicherry INDIA 605005",Indian Non-Government Company
U30007PY2009PTC002264,V NET TECHNOLOGY PRIVATE LIMITED,ACTIVE,PRIV,CLSH,500000,100000,13-02-09,Pondicherry,RoC-Pondicherry,Manufacturing (Machinery & Equipments),"162, KAMARAJ SALAI BRINDAVANAM PONDICHERY Pondicherry INDIA 605013",Indian Non-Government Company
U72900PY2009PTC002265,PROINFOCUS INDIA PRIVATE LIMITED,ACTIVE,PRIV,CLSH,500000,500000,13-02-09,Pondicherry,RoC-Pondicherry,Business Services,"NO 19, SECOND CROSS, SANKARADASS SWAMIGAL NAGAR LAWSPET Pondicherry INDIA 605008",Indian Non-Government Company
U28113PY2009PTC002280,EVEREST TENT TECHNOLOGIES INDIA PRIVATE LIMITED,ACTIVE,PRIV,CLSH,500000,500000,27-03-09,Pondicherry,RoC-Pondicherry,"Manufacturing (Metals & Chemicals, and products thereof)","NO 24, SRIRAM NAGAR ARIYANKUPPAM PONDICHERRY Pondicherry INDIA 605007",Indian Non-Government Company
U65990PY2009PTC002275,GOWTHAM FINANCE PRIVATE LIMITED,ACTIVE,PRIV,CLSH,100000,100000,23-03-09,Pondicherry,RoC-Pondicherry,Finance,"17, V.K.S Illam, Ayyanar Koil Street, Anna Nagar Extention, Pondicherry Pondicherry INDIA 605001",Indian Non-Government Company
U51395PY2009PTC002267,SANGAMAM MOBILES PRIVATE LIMITED,ACTIVE,PRIV,CLSH,2100000,2100000,03-04-09,Pondicherry,RoC-Pondicherry,Trading,NO 89 MAHATMA GANDHI ROAD PONDICHERRY Pondicherry INDIA 605001,Indian Non-Government Company
U40109PY2009PTC002272,VARUNA ENERGY & WATER PRIVATE LIMITED,ACTIVE,PRIV,CLSH,60000000,56218000,03-11-09,Pondicherry,RoC-Pondicherry,"Electricity, Gas & Water companies","ADITI DIAMONDS COMPOUND, KENNEDY NAGAR PONDICHERRY Pondicherry INDIA 605001",Indian Non-Government Company
U51391PY2009PTC002274,XELLENNT COSMETIC PRIVATE LIMITED,ACTIVE,PRIV,CLSH,100000,100000,17-03-09,Pondicherry,RoC-Pondicherry,Trading,"N0.15/C, FIRST FLOOR, KAMATCHI COMPLEX, PETHUCHETIPET, LAWSPET MAIN ROAD, PONDICHERRY Pondicherry INDIA 605008",Indian Non-Government Company
U41000PY2009PTC002273,WATER CARE INDIA PRIVATE LIMITED,ACTIVE,PRIV,CLSH,9000000,3800000,17-03-09,Pondicherry,RoC-Pondicherry,"Electricity, Gas & Water companies","ADER INDIA, MUNISAMY PILLAI PLAZA S-2, SECOND FLOOR, 111 & 113, GINGEE SALAI PONDICHERRY Pondicherry INDIA 605001",Indian Non-Government Company
U45200PY2009PTC002305,SRI SOKKANALLI AMMAN PROMOTERS PRIVATE LIMITED,ACTIVE,PRIV,CLSH,200000,200000,05-07-09,Pondicherry,RoC-Pondicherry,Construction,NO 8 KAVERI NAGAR REDDIARPALAYAM Pondicherry INDIA 605010,Indian Non-Government Company
U72300PY2009PTC002269,EASYWAY TRANSLATION PRIVATE LIMITED,STRIKE OFF,PRIV,CLSH,100000,100000,03-06-09,Pondicherry,RoC-Pondicherry,Business Services,"89A, LAPORTE STREET, PONDICHERRY Pondicherry INDIA 605001",Indian Non-Government Company
U72900PY2009PTC002270,CEDAT SOFTWARE SERVICES PRIVATE LIMITED,ACTIVE,PRIV,CLSH,100000,100000,03-06-09,Pondicherry,RoC-Pondicherry,Business Services,"NO 11, AUROBINDO STREET PONDICHERRY Pondicherry INDIA 605001",Indian Non-Government Company
U55101PY2009PTC002271,SOUTHERN INDO LEISURE AND CULTURE PRIVATE LIMITED,ACTIVE,PRIV,CLSH,100000,100000,03-11-09,Pondicherry,RoC-Pondicherry,Trading,"NEW NO 9 & OLD NO 11 28TH CROSS, 4TH MAIN ROAD, AVVAI NAGAR LAWSPET Pondicherry INDIA 605008",Indian Non-Government Company
U74900PY2009PTC002301,ARUDHRA TRADING PRIVATE LIMITED,ACTIVE,PRIV,CLSH,100000,100000,23-04-09,Pondicherry,RoC-Pondicherry,Business Services,"No. 303, MARAI MALAI ADIGAL SALAI NELLITHOPE PUDUCHERRY Pondicherry INDIA 605005",Indian Non-Government Company
U74900PY2009PTC002287,MERIDIAN CASH MANAGEMENT SERVICES PRIVATE LIMITED,ACTIVE,PRIV,CLSH,100000,100000,15-04-09,Pondicherry,RoC-Pondicherry,Business Services,"54, BARATHI STREET 100 FEET ROAD ELLAPILLAI CHAVADY PUDUCHERRY Pondicherry INDIA 605005",Indian Non-Government Company
U72200PY2009PTC002277,CYBRUS TECHNOLOGIES PRIVATE LIMITED,ACTIVE,PRIV,CLSH,500000,500000,26-03-09,Pondicherry,RoC-Pondicherry,Business Services,NO.61 PERUMAL KOVIL STREET PONDICHERRY Pondicherry INDIA 605001,Indian Non-Government Company
U52393PY2009PTC002276,JAYA UTOPIA PRIVATE LIMITED,ACTIVE,PRIV,CLSH,400000,400000,25-03-09,Pondicherry,RoC-Pondicherry,Trading,NO 66 CHETTY STREET PDUDUCHERRY Pondicherry INDIA 605001,Indian Non-Government Company
U27100PY2009PTC002282,NITHYA STEELS AND ALLOYS PRIVATE LIMITED,ACTIVE,PRIV,CLSH,160000000,150300000,04-06-09,Pondicherry,RoC-Pondicherry,"Manufacturing (Metals & Chemicals, and products thereof)","N0.48, THIRD CROSS STREET ANADHARANGA PILLAI NAGAR,LAWSPET PONDICHERRY Pondicherry INDIA 606008",Indian Non-Government Company
U51909PY2009PTC002289,COROMANDEL ART GALLERY PRIVATE LIMITED,ACTIVE,PRIV,CLSH,100000,100000,15-04-09,Pondicherry,RoC-Pondicherry,Trading,"30, LOUIS PRAGASAM STREET PONDICHERRY Pondicherry INDIA 605001",Indian Non-Government Company
U72900PY2009PTC002279,ALLPHA SOLUTIONS PONDICHERRY PRIVATE LIMITED,ACTIVE,PRIV,CLSH,100000,100000,27-03-09,Pondicherry,RoC-Pondicherry,Business Services,"5, II FLOOR, ELLAPILLAI CHAVADI MAIN ROAD NEAR JK TOWER, PONDICHERRY PONDICHERRY Pondicherry INDIA 600013",Indian Non-Government Company
U93090PY2009PTC002278,SOUTH POLE DEALING AND CONSULTING PRIVATE LIMITED,STRIKE OFF,PRIV,CLSH,100000,100000,27-03-09,Pondicherry,RoC-Pondicherry,"Community, personal & Social Services","414, BHARATHI STREET PUDUCHERRY Pondicherry INDIA 605001",Indian Non-Government Company
U51399PY2009PTC002281,SWISS FRANCE HEALTH NATURA PRIVATE LIMITED,ACTIVE,PRIV,CLSH,100000,100000,04-02-09,Pondicherry,RoC-Pondicherry,Trading,6 FRANSIAS DASSIS KURUCHIKUPPAM PONDICHERRY Pondicherry INDIA 605012,Indian Non-Government Company
U74900PY2009PTC002288,KARAIKAL EXIM PRIVATE LIMITED,ACTIVE,PRIV,CLSH,100000,100000,15-04-09,Pondicherry,RoC-Pondicherry,Business Services,"408, BHARATI STREET PUDUCHERRY Pondicherry INDIA 605001",Indian Non-Government Company
U45200PY2009PTC002300,IMPERIAL HABITAT PRIVATE LIMITED,ACTIVE,PRIV,CLSH,100000,100000,17-04-09,Pondicherry,RoC-Pondicherry,Construction,"414, BHARATHI STREET PUDUCHERRY Pondicherry INDIA 605001",Indian Non-Government Company
U45200PY2009PTC002294,GUIDING INFRADEVELOPERS PRIVATE LIMITED,ACTIVE,PRIV,CLSH,100000,100000,17-04-09,Pondicherry,RoC-Pondicherry,Construction,"414, BHARATHI STREET PUDUCHERRY Pondicherry INDIA 605001",Indian Non-Government Company
U45200PY2009PTC002293,HOPEFUL INFRASTRUCTURE PRIVATE LIMITED,ACTIVE,PRIV,CLSH,100000,100000,17-04-09,Pondicherry,RoC-Pondicherry,Construction,"414, BHARATHI STREET PUDUCHERRY Pondicherry INDIA 605001",Indian Non-Government Company
U45200PY2009PTC002297,SYNERGY HABITAT PRIVATE LIMITED,ACTIVE,PRIV,CLSH,100000,100000,17-04-09,Pondicherry,RoC-Pondicherry,Construction,"414, BHARATHI STREET PUDUCHERRY Pondicherry INDIA 605001",Indian Non-Government Company
U45200PY2009PTC002296,AKSHYA INFRASTRUCTURE PRIVATE LIMITED,ACTIVE,PRIV,CLSH,50000000,45000000,17-04-09,Pondicherry,RoC-Pondicherry,Construction,"414, BHARATHI STREET PUDUCHERRY Pondicherry INDIA 605001",Indian Non-Government Company
U45200PY2009PTC002295,ADHUNIK INFRADEVELOPERS PRIVATE LIMITED,ACTIVE,PRIV,CLSH,100000,100000,17-04-09,Pondicherry,RoC-Pondicherry,Construction,"No.34,1-Floor, Jeevandam street, Pondicherry Pondicherry INDIA 605001",Indian Non-Government Company
U45200PY2009PTC002291,SPARK INFRASTRUCTURE PRIVATE LIMITED,ACTIVE,PRIV,CLSH,10000000,5000000,17-04-09,Pondicherry,RoC-Pondicherry,Construction,"No. 47 A, Sedarpet Main Road Rajiv Gandhi Nagar, Sedarpet Puducherry Pondicherry INDIA 605111",Indian Non-Government Company
U45200PY2009PTC002299,DWARAKA INFRADEVELOPERS PRIVATE LIMITED,ACTIVE,PRIV,CLSH,100000,100000,17-04-09,Pondicherry,RoC-Pondicherry,Construction,"18/A, NEEDARAJA PAIYER STREET, CANTEEN STREET CUTTING, PONDICHERRY Pondicherry INDIA 605001",Indian Non-Government Company
U45200PY2009PTC002292,DHRUV TARA INFRASTRUCTURE PRIVATE LIMITED,ACTIVE,PRIV,CLSH,100000,100000,17-04-09,Pondicherry,RoC-Pondicherry,Construction,"414, BHARATHI STREET PUDUCHERRY Pondicherry INDIA 605001",Indian Non-Government Company
U55101PY2009PTC002283,DAKSHINA RESIDENCES PRIVATE LIMITED,STRIKE OFF,PRIV,CLSH,100000,100000,04-08-09,Pondicherry,RoC-Pondicherry,Trading,"82, LAL BAHADUR SHASTRI STREET, PONDICHERRY Pondicherry INDIA 605001",Indian Non-Government Company
U21014PY2009PTC002286,BESTOW PACKAGING PRIVATE LIMITED,ACTIVE,PRIV,CLSH,100000,100000,04-08-09,Pondicherry,RoC-Pondicherry,"Manufacturing (Paper & Paper products, Publishing, printing and reproduction of recorded media)","C 101 17TH CROSS, PIPDIC INDUSTRIAL ESTATE, METTUPALAYAM Pondicherry INDIA 605009",Indian Non-Government Company
U52341PY2009PTC002284,S I STEEL TUBES PRIVATE LIMITED,ACTIVE,PRIV,CLSH,2000000,2000000,04-08-09,Pondicherry,RoC-Pondicherry,Trading,"55, VAZHUDAVOOR ROAD, NAVASAKTHI NAGAR, PONDICHERRY Pondicherry INDIA 605009",Indian Non-Government Company
U52390PY2009PTC002285,S I STEELS INDIA PRIVATE LIMITED,ACTIVE,PRIV,CLSH,15000000,10685000,04-08-09,Pondicherry,RoC-Pondicherry,Trading,"102, VAZHUDAVOOR ROAD, KASTHURIBAI NAGAR, PONDICHERRY Pondicherry INDIA 605010",Indian Non-Government Company
U18109PY2009PTC002290,MANDALA APPARELS PRIVATE LIMITED,ACTIVE,PRIV,CLSH,19900000,14254540,16-04-09,Pondicherry,RoC-Pondicherry,Manufacturing (Textiles),"FLAT E, J J APARTMENTS 7 RANGAPILLAI STREET PONDICHERRY Pondicherry INDIA 605001",Indian Non-Government Company
U45200PY2009PTC002298,DOLPHIN INFRADEVELOPERS PRIVATE LIMITED,ACTIVE,PRIV,CLSH,100000,100000,17-04-09,Pondicherry,RoC-Pondicherry,Construction,"414, BHARATHI STREET PUDUCHERRY Pondicherry INDIA 605001",Indian Non-Government Company
U74999PY2009PTC002302,SMARTWORLD SUPERSAVER'S CLUB PRIVATE LIMITED,ACTIVE,PRIV,CLSH,150000,150000,28-04-09,Pondicherry,RoC-Pondicherry,Business Services,"No.66, 1st floor, Maraimalai Adigal Salai, PUDUCHERRY Pondicherry INDIA 605001",Indian Non-Government Company
U36999PY2009PTC002319,BIO INDIA POLYMERS PRIVATE LIMITED,ACTIVE,PRIV,CLSH,500000,450000,15-06-09,Pondicherry,RoC-Pondicherry,Manufacturing (Others),43 VILLINAUR ROAD PAVAZHA NAGAR Pondicherry INDIA 605005,Indian Non-Government Company
U18109PY2009PTC002312,OFFBEAT APPARELS INDIA PRIVATE LIMITED,ACTIVE,PRIV,CLSH,9000000,8400100,26-05-09,Pondicherry,RoC-Pondicherry,Manufacturing (Textiles),"NO.16, MARIAMMAN KOIL STREET VAZHAIKULAM PONDICHERRY Pondicherry INDIA 605012",Indian Non-Government Company
U18109PY2009PTC002303,FAIR AND ORGANIC COTTON TRADE PRIVATE LIMITED,ACTIVE,PRIV,CLSH,600000,600000,05-01-09,Pondicherry,RoC-Pondicherry,Manufacturing (Textiles),"NO.13, SURCOUF STREET, PONDICHERRY Pondicherry INDIA 605001",Indian Non-Government Company
U74900PY2009PTC002310,E-QUIRE TECHNOLOGIES PRIVATE LIMITED,ACTIVE,PRIV,CLSH,100000,100,18-05-09,Pondicherry,RoC-Pondicherry,Business Services,"78,2ND CROSS SITHANANDA NAGAR PONDICHERRY Pondicherry INDIA 605005",Indian Non-Government Company
U74999PY2009PTC002304,N.Z. BEAUTY MASTER PRIVATE LIMITED,ACTIVE,PRIV,CLSH,100000,100000,05-05-09,Pondicherry,RoC-Pondicherry,Business Services,"2, 3RD CROSS, VEDHANAYAGAM STREET, COLAS NAGAR, UPPALAM, PONDICHERRY Pondicherry INDIA 605001",Indian Non-Government Company
U55100PY2009PTC002306,MAISON DES ARTS PRIVATE LIMITED,ACTIVE,PRIV,CLSH,500000,100000,14-05-09,Pondicherry,RoC-Pondicherry,Trading,"NO.518/196, MAHATMA GANDHI ROAD PONDICHERRY Pondicherry INDIA 605001",Indian Non-Government Company
U51432PY2009PTC002316,PUDUCHERRY BUILDMART PRIVATE LIMITED,ACTIVE,PRIV,CLSH,6500000,6100000,06-03-09,Pondicherry,RoC-Pondicherry,Trading,"193, Rengapillai Street, Pondicherry Pondicherry INDIA 605001",Indian Non-Government Company
U52393PY2009PTC002313,SO DID JEWELLERY PRIVATE LIMITED,ACTIVE,PRIV,CLSH,100000,100000,26-05-09,Pondicherry,RoC-Pondicherry,Trading,"No.30, Villa Sophie, Rue Saint Vincent de Paul Street, Colas Nagar, Pondicherry Pondicherry INDIA 605001",Indian Non-Government Company
U52333PY2009PTC002307,CANE LAB DESIGN PRIVATE LIMITED,STRIKE OFF,PRIV,CLSH,1000000,1000000,14-05-09,Pondicherry,RoC-Pondicherry,Trading,"45B, ROMAIN ROLLAND STREET PONDICHERRY Pondicherry INDIA 605001",Indian Non-Government Company
U55101PY2009PTC002309,MOTHER CARE HOLIDAYS RESORTS PRIVATE LIMITED,ACTIVE,PRIV,CLSH,50000000,12141000,15-05-09,Pondicherry,RoC-Pondicherry,Trading,"OLD NO 28, NEW NO 8, 1 ST CROSS, ARAVINDAR NAGAR, REDDIARPALAYAM, PONDICHERRY Pondicherry INDIA 605010",Indian Non-Government Company
U72200PY2009PTC002323,ACTECH SOFTWARE PRIVATE LIMITED,ACTIVE,PRIV,CLSH,100000,100000,07-08-09,Pondicherry,RoC-Pondicherry,Business Services,"56, RANGAPILLAI STREET PUDUCHERRY Pondicherry INDIA 605001",Indian Non-Government Company
U74900PY2009PTC002308,PONDY MANAGEMENT SERVICES PRIVATE LIMITED,ACTIVE,PRIV,CLSH,100000,100000,15-05-09,Pondicherry,RoC-Pondicherry,Business Services,50 AUROBINDO STREET PONDICHERRY Pondicherry INDIA 605001,Indian Non-Government Company
U52320PY2009PTC002311,PONDICHERRY EXPORT AND MARKETING PRIVATE LIMITED,ACTIVE,PRIV,CLSH,100000,100000,26-05-09,Pondicherry,RoC-Pondicherry,Trading,"NO.60, GOUBERT AVENUE, PONDICHERRY Pondicherry INDIA 605001",Indian Non-Government Company
U74999PY2009PTC002317,FREE MARK MEDIA PUBLICATIONS PRIVATE LIMITED,ACTIVE,PRIV,CLSH,100000,100000,06-03-09,Pondicherry,RoC-Pondicherry,Business Services,146 EASWARAN KOIL STREET PONDICHERRY Pondicherry INDIA 605001,Indian Non-Government Company
U36100PY2009PTC002314,METRO STEEL ROCINGS PRIVATE LIMITED,ACTIVE,PRIV,CLSH,100000,100000,29-05-09,Pondicherry,RoC-Pondicherry,Manufacturing (Others),"NO.1,VANNIAYAR STREET, II CROSS VEERAMPATTINAM PONDICHERRY Pondicherry INDIA 605007",Indian Non-Government Company
U29210PY2009PTC002321,GREEN INDUS AGRO-TECH PRIVATE LIMITED,ACTIVE,PRIV,CLSH,500000,500000,17-06-09,Pondicherry,RoC-Pondicherry,Manufacturing (Machinery & Equipments),"No.5, Sadish Illam,Mariamman Koil Street Kottupalayam Pondicherry Pondicherry INDIA 605008",Indian Non-Government Company
U45200PY2009PTC002315,SHRI JANANI HOMES PRIVATE LIMITED,ACTIVE,PRIV,CLSH,32500000,31100000,29-05-09,Pondicherry,RoC-Pondicherry,Construction,NO 9 II ND CROSS SRI MOOKAMBIGAI NAGAR REDDIYAR PALYAM PONDICHERRY Pondicherry INDIA 605010,Indian Non-Government Company
U15410PY2009PTC002318,RERA CONSUMER CARE PRIVATE LIMITED,ACTIVE,PRIV,CLSH,200000,200000,06-09-09,Pondicherry,RoC-Pondicherry,Manufacturing (Food stuffs),"49, 4th CROSS STREET RAINBOW NAGAR PONDICHERRY Pondicherry INDIA 605011",Indian Non-Government Company
U74999PY2009PTC002330,MAYILE TOUR (PUDUCHERRY) PRIVATE LIMITED,ACTIVE,PRIV,CLSH,500000,300000,07-10-09,Pondicherry,RoC-Pondicherry,Business Services,"NO.25, RIVER BANK (ATRANKARAI) STREE NONANKUPPAM PONDICHERRY Pondicherry INDIA 605007",Indian Non-Government Company
U74140PY2009PTC002320,PRASHANTH PROPERTIES PRIVATE LIMITED,ACTIVE,PRIV,CLSH,100000000,45722000,17-06-09,Pondicherry,RoC-Pondicherry,Business Services,"86, CANTEEN STREET PONDICHERRY Pondicherry INDIA 605001",Indian Non-Government Company
U45200PY2009PTC002324,ACUTE INFRASTRUCTURE PRIVATE LIMITED,ACTIVE,PRIV,CLSH,10000000,6500000,07-08-09,Pondicherry,RoC-Pondicherry,Construction,"No. 47 B, Sedarpet Main Road Rajiv Gandhi Nagar, Sedarpet Puducherry Pondicherry INDIA 605111",Indian Non-Government Company
U45200PY2009PTC002326,ADVANCE INFRADEVELOPERS PRIVATE LIMITED,ACTIVE,PRIV,CLSH,100000,100000,07-08-09,Pondicherry,RoC-Pondicherry,Construction,"414, BHARATHI STREET PUDUCHERRY Pondicherry INDIA 605001",Indian Non-Government Company
U45200PY2009PTC002327,AGNI INFRADEVELOPERS PRIVATE LIMITED,ACTIVE,PRIV,CLSH,100000,100000,07-08-09,Pondicherry,RoC-Pondicherry,Construction,"414, BHARATHI STREET PUDUCHERRY Pondicherry INDIA 605001",Indian Non-Government Company
U45200PY2009PTC002325,ARCHANA INFRADEVELOPERS PRIVATE LIMITED,ACTIVE,PRIV,CLSH,100000,100000,07-08-09,Pondicherry,RoC-Pondicherry,Construction,"414, BHARATHI STREET PUDUCHERRY Pondicherry INDIA 605001",Indian Non-Government Company
U45200PY2009PTC002329,ASHRAM INFRADEVELOPERS PRIVATE LIMITED,ACTIVE,PRIV,CLSH,100000,100000,07-08-09,Pondicherry,RoC-Pondicherry,Construction,"414, BHARATHI STREET PUDUCHERRY Pondicherry INDIA 605001",Indian Non-Government Company
U45200PY2009PTC002332,COMEX INFRASTRUCTURE PRIVATE LIMITED,ACTIVE,PRIV,CLSH,100000,100000,14-07-09,Pondicherry,RoC-Pondicherry,Construction,"414, BHARATHI STREET PUDUCHERRY Pondicherry INDIA 605001",Indian Non-Government Company
U45200PY2009PTC002333,FLYING INFRADEVELOPERS PRIVATE LIMITED,ACTIVE,PRIV,CLSH,100000,100000,14-07-09,Pondicherry,RoC-Pondicherry,Construction,"414, BHARATHI STREET PUDUCHERRY Pondicherry INDIA 605001",Indian Non-Government Company
U45200PY2009PTC002334,SHIKHA INFRASTRUCTURE PRIVATE LIMITED,ACTIVE,PRIV,CLSH,100000,100000,20-07-09,Pondicherry,RoC-Pondicherry,Construction,"414, BHARATHI STREET PUDUCHERRY Pondicherry INDIA 605001",Indian Non-Government Company
U45200PY2009PTC002328,SURYODAYA BUDGET HOUSING PRIVATE LIMITED,STRIKE OFF,PRIV,CLSH,100000,100000,07-08-09,Pondicherry,RoC-Pondicherry,Construction,"414, BHARATHI STREET PUDUCHERRY Pondicherry INDIA 605001",Indian Non-Government Company
U45200PY2009PTC002331,UNISTAR INFRADEVELOPERS PRIVATE LIMITED,STRIKE OFF,PRIV,CLSH,100000,100000,14-07-09,Pondicherry,RoC-Pondicherry,Construction,"414, BHARATHI STREET PUDUCHERRY Pondicherry INDIA 605001",Indian Non-Government Company
U72900PY2009PTC002322,KLICKSKILL PRIVATE LIMITED,ACTIVE,PRIV,CLSH,100000,100000,07-06-09,Pondicherry,RoC-Pondicherry,Business Services,"NO. 22, 8TH CROSS, RAJAJI NAGAR LAWSPET PONDICHERRY Pondicherry INDIA 605008",Indian Non-Government Company
U74140PY2009PTC002339,VIRGO VENTURES PRIVATE LIMITED,ACTIVE,PRIV,CLSH,20000000,20000000,08-11-09,Pondicherry,RoC-Pondicherry,Business Services,"No.574, M.G.Road Puducherry PUDUCHERRY Pondicherry INDIA 605001",Indian Non-Government Company
U25201PY2009PTC002341,APEX TENT INDIA PRIVATE LIMITED,ACTIVE,PRIV,CLSH,500000,500000,13-08-09,Pondicherry,RoC-Pondicherry,"Manufacturing (Metals & Chemicals, and products thereof)","No.93/2, ERIKKARI STREET, KIRUMAMBHAKKAM PUDUCHERRY Pondicherry INDIA 607402",Indian Non-Government Company
U72900PY2009PTC002358,KNS TECHNOLOGIES PRIVATE LIMITED,ACTIVE,PRIV,CLSH,100000,100000,09-01-09,Pondicherry,RoC-Pondicherry,Business Services,"NO.140, FIRST FLOOR, CHERAN STREET SIVAKAMIAMMAL NAGAR ARIYANKUPPAM Pondicherry INDIA 605007",Indian Non-Government Company
U45200PY2009PTC002349,DHANUSH DEVELOPERS PRIVATE LIMITED,ACTIVE,PRIV,CLSH,100000,100000,31-08-09,Pondicherry,RoC-Pondicherry,Construction,"414, BHARATHI STREET PUDUCHERRY Pondicherry INDIA 605001",Indian Non-Government Company
U74910PY2009PTC002337,HALAL INDIA PRIVATE LIMITED,ACTIVE,PRIV,CLSH,500000,500000,08-05-09,Pondicherry,RoC-Pondicherry,Business Services,"No.185, IInd Cross Street, Barathiyar Nagar Periyakalapet Puducherry Pondicherry INDIA 605014",Indian Non-Government Company
U45200PY2009PTC002347,BALAN INFRASTRUCTURE PRIVATE LIMITED,ACTIVE,PRIV,CLSH,100000,100000,31-08-09,Pondicherry,RoC-Pondicherry,Construction,"414, BHARATHI STREET PUDUCHERRY Pondicherry INDIA 605001",Indian Non-Government Company
U14290PY2009PTC002351,JEET PROJECTS PRIVATE LIMITED,ACTIVE,PRIV,CLSH,100000,100000,31-08-09,Pondicherry,RoC-Pondicherry,Mining & Quarrying,"414, BHARATHI STREET PUDUCHERRY Pondicherry INDIA 605001",Indian Non-Government Company
U45200PY2009PTC002352,ROSHAN INFRASTRUCTURE PRIVATE LIMITED,ACTIVE,PRIV,CLSH,100000,100000,31-08-09,Pondicherry,RoC-Pondicherry,Construction,"414, BHARATHI STREET PUDUCHERRY Pondicherry INDIA 605001",Indian Non-Government Company
U45200PY2009PTC002348,DHANRAJ PROJECTS PRIVATE LIMITED,ACTIVE,PRIV,CLSH,100000,100000,31-08-09,Pondicherry,RoC-Pondicherry,Construction,"414, BHARATHI STREET PUDUCHERRY Pondicherry INDIA 605001",Indian Non-Government Company
U45200PY2009PTC002350,JAIRAJ INFRASTRUCTURE PRIVATE LIMITED,ACTIVE,PRIV,CLSH,100000,100000,31-08-09,Pondicherry,RoC-Pondicherry,Construction,"414, BHARATHI STREET PUDUCHERRY Pondicherry INDIA 605001",Indian Non-Government Company
U45200PY2009PTC002353,STYLOG INFRASTRUCTURE PRIVATE LIMITED,ACTIVE,PRIV,CLSH,100000,100000,31-08-09,Pondicherry,RoC-Pondicherry,Construction,"414, BHARATHI STREET PUDUCHERRY Pondicherry INDIA 605001",Indian Non-Government Company
U45200PY2009PTC002354,UDAYAGIRI INFRASTRUCTURE PRIVATE LIMITED,ACTIVE,PRIV,CLSH,100000,100000,09-01-09,Pondicherry,RoC-Pondicherry,Construction,"414, BHARATHI STREET PUDUCHERRY Pondicherry INDIA 605001",Indian Non-Government Company
U45200PY2009PTC002355,SHEETAL HOMES PRIVATE LIMITED,ACTIVE,PRIV,CLSH,100000,100000,09-01-09,Pondicherry,RoC-Pondicherry,Construction,"414, BHARATHI STREET PUDUCHERRY Pondicherry INDIA 605001",Indian Non-Government Company
U45200PY2009PTC002357,PIYUSH CONSTRUCTIONS PRIVATE LIMITED,ACTIVE,PRIV,CLSH,100000,100000,09-01-09,Pondicherry,RoC-Pondicherry,Construction,"414, BHARATHI STREET PUDUCHERRY Pondicherry INDIA 605001",Indian Non-Government Company
U74140PY2009PTC002336,E-INFLEXION PRIVATE LIMITED,ACTIVE,PRIV,CLSH,100000,100000,29-07-09,Pondicherry,RoC-Pondicherry,Business Services,"PLOT NO.112, DOOR NO.25, 4TH CROSS STREET, JAWAHAR NAGAR, REDDIARPALAYAM, PONDICHERRY Pondicherry INDIA 605010",Indian Non-Government Company
U31909PY2009PTC002338,GENERAL CONNECTORS (INDIA) PRIVATE LIMITED,ACTIVE,PRIV,CLSH,1000000,1000000,08-11-09,Pondicherry,RoC-Pondicherry,Manufacturing (Machinery & Equipments),"NO.306, CUDDALORE ROAD, MUDALIARPET PONDICHERRY Pondicherry INDIA 605004",Indian Non-Government Company
U63040PY2009PTC002346,HARINI CONSULTANCY & AIR TRAVELS PRIVATE LIMITED,ACTIVE,PRIV,CLSH,200000,100000,25-08-09,Pondicherry,RoC-Pondicherry,"Transport, storage and Communications","NO.16/2, MAIN ROAD, OPP. POLITECNIC VARICHIKUDI KARAIKAL Pondicherry INDIA 609609",Indian Non-Government Company
U24239PY2009PTC002340,ETHIDRUGS RESEARCH LAB PRIVATE LIMITED,ACTIVE,PRIV,CLSH,100000,100000,08-11-09,Pondicherry,RoC-Pondicherry,"Manufacturing (Metals & Chemicals, and products thereof)","RS 2/1, PLOT NO 81/82/83/84, DOOR NO : 174, SECOND CROSS, KURUMBAPET, PONDICHERRY Pondicherry INDIA 605009",Indian Non-Government Company
U74900PY2009PTC002343,NFX E-SHOP PUDUCHERRY PRIVATE LIMITED,ACTIVE,PRIV,CLSH,100000,100000,18-08-09,Pondicherry,RoC-Pondicherry,Business Services,3 NOBILI ADIGAL STREET COLAS NAGAR PONDICHERRY Pondicherry INDIA 605001,Indian Non-Government Company
U72900PY2009PTC002344,APS HITECH INDIA PRIVATE LIMITED,ACTIVE,PRIV,CLSH,500000,100000,21-08-09,Pondicherry,RoC-Pondicherry,Business Services,"24, KANNAYAR STREET, KUYAVARPALAYAM PONDICHERRY Pondicherry INDIA 605013",Indian Non-Government Company
U24100PY2009PTC002362,VASANTH CHEMICALS PRIVATE LIMITED,ACTIVE,PRIV,CLSH,22500000,1000000,09-07-09,Pondicherry,RoC-Pondicherry,"Manufacturing (Metals & Chemicals, and products thereof)","NO 16/12 SANYASIKUPPAM ROAD, T V KOIL VILLAGE, KANDAMANGALAM POST, MANADIPET PONDICHERRY Pondicherry INDIA 605102",Indian Non-Government Company
U74140PY2009PTC002369,CORIANDER BUILDINGS PRIVATE LIMITED,ACTIVE,PRIV,CLSH,3500000,100000,19-10-09,Pondicherry,RoC-Pondicherry,Business Services,"NO.1, ANGALAMMAN KOIL STREET VAMBAKEERAPALAYAM PONDICHERRY Pondicherry INDIA 605001",Indian Non-Government Company
U30000PY2009PTC002342,ATOM GOPHER SOLUTIONS PRIVATE LIMITED,ACTIVE,PRIV,CLSH,100000,100000,17-08-09,Pondicherry,RoC-Pondicherry,Manufacturing (Machinery & Equipments),"NO.56, LAWSPET MAIN ROAD, BHARATHI NAGAR, LAWSPET PONDICHERRY Pondicherry INDIA 605008",Indian Non-Government Company
U74900PY2009PTC002345,JEYAN SERVICE PRIVATE LIMITED,ACTIVE,PRIV,CLSH,100000,100000,21-08-09,Pondicherry,RoC-Pondicherry,Business Services,L BLOCK NO 9 JAWAHAR NAGAR PUDUCHERRY Pondicherry INDIA 605005,Indian Non-Government Company
U72900PY2009PTC002365,H & S TECHNOLOGIES PRIVATE LIMITED,ACTIVE,PRIV,CLSH,100000,100000,29-09-09,Pondicherry,RoC-Pondicherry,Business Services,"No.34 A, Mettu Street, Koodapakkam Pondicherry Pondicherry INDIA 605502",Indian Non-Government Company
U74900PY2009PTC002356,EXEMPLARR WORLDWIDE SHIPPING SOLUTIONS PRIVATE LIMITED,ACTIVE,PRIV,CLSH,45000000,26100000,09-01-09,Pondicherry,RoC-Pondicherry,Business Services,KEEZHA VANJORE VILLAGE T R PATTINAM KARAIKAL Pondicherry INDIA 609606,Indian Non-Government Company
U74900PY2009PTC002359,DYNAMIC LINK LOGISTICS PRIVATE LIMITED,ACTIVE,PRIV,CLSH,100000,100000,09-03-09,Pondicherry,RoC-Pondicherry,Business Services,"NO 62, SALAI STREET, MOOLAKULAM PUDUCHERRY Pondicherry INDIA 605010",Indian Non-Government Company
U36100PY2009PTC002361,MULTI MOVING SYSTEMS PRIVATE LIMITED,ACTIVE,PRIV,CLSH,100000,100000,09-07-09,Pondicherry,RoC-Pondicherry,Manufacturing (Others),66 Petit Canal Street PONDICHERRY Pondicherry INDIA 605001,Indian Non-Government Company
U74140PY2009PTC002360,SERENITY CONSULTING PRIVATE LIMITED,ACTIVE,PRIV,CLSH,100000,100000,09-04-09,Pondicherry,RoC-Pondicherry,Business Services,66 PETIT CANAL STREET PONDICHERRY Pondicherry INDIA 605001,Indian Non-Government Company
